free_text,label_id,source,url,category
"Thái Nguyên phấn đấu giảm tỷ suất trẻ em bị tai nạn, thương tích xuống còn 0,5% năm 2025",0,dansinh_vi_tre_em,https://dansinh.dantri.com.vn/vi-tre-em/thai-nguyen-phan-dau-giam-ty-suat-tre-em-bi-tai-nan-thuong-tich-xuong-con-05-nam-2025-20211020223842000.htm,vi-tre-em
Đề xuất chính sách hỗ trợ trẻ em mồ côi do dịch Covid-19,0,dansinh_vi_tre_em,https://dansinh.dantri.com.vn/vi-tre-em/de-xuat-chinh-sach-ho-tro-tre-em-mo-coi-do-dich-covid-19-20211019181126000.htm,vi-tre-em
TP.HCM gần 2.000 trẻ mồ côi sau dịch Covid-19,0,dansinh_vi_tre_em,https://dansinh.dantri.com.vn/vi-tre-em/tphcm-gan-2000-tre-mo-coi-sau-dich-covid-19-20211019150638000.htm,vi-tre-em
Quỹ Bảo trợ trẻ em Việt nam đồng hành hỗ trợ trẻ em bị ảnh hưởng COVID-19,0,dansinh_vi_tre_em,https://dansinh.dantri.com.vn/vi-tre-em/quy-bao-tro-tre-em-viet-nam-dong-hanh-ho-tro-tre-em-bi-anh-huong-covid-19-20211019143924000.htm,vi-tre-em
"Rà soát, đề xuất chính sách hỗ trợ trẻ mồ côi do dịch COVID-19",0,dansinh_vi_tre_em,https://dansinh.dantri.com.vn/vi-tre-em/ra-soat-de-xuat-chinh-sach-ho-tro-tre-mo-coi-do-dich-covid-19-20211018130905000.htm,vi-tre-em
Đà Nẵng phấn đấu không có lao động trẻ em và người chưa thành niên trái quy định của pháp luật,0,dansinh_vi_tre_em,https://dansinh.dantri.com.vn/vi-tre-em/da-nang-phan-dau-khong-co-lao-dong-tre-em-va-nguoi-chua-thanh-nien-trai-quy-dinh-cua-phap-luat-20211016134942000.htm,vi-tre-em
Nhận đỡ đầu 650 trẻ mồ côi do dịch COVID-19,0,dansinh_vi_tre_em,https://dansinh.dantri.com.vn/vi-tre-em/nhan-do-dau-650-tre-mo-coi-do-dich-covid-19-20211016090115000.htm,vi-tre-em
Kỹ năng trò chuyện với trẻ về dịch bệnh COVID-19,0,dansinh_vi_tre_em,https://dansinh.dantri.com.vn/vi-tre-em/ky-nang-tro-chuyen-voi-tre-ve-dich-benh-covid-19-20211015171303000.htm,vi-tre-em
"Bắc Ninh ban hành Kế hoạch phòng, chống tai nạn, thương tích trẻ em giai đoạn 2021 - 2030",0,dansinh_vi_tre_em,https://dansinh.dantri.com.vn/vi-tre-em/bac-ninh-ban-hanh-ke-hoach-phong-chong-tai-nan-thuong-tich-tre-em-giai-doan-2021-2030-20211015094210000.htm,vi-tre-em
Kịp thời hỗ trợ pháp lý cho trẻ em mồ côi do đại dịch Covid-19,0,dansinh_vi_tre_em,https://dansinh.dantri.com.vn/vi-tre-em/kip-thoi-ho-tro-phap-ly-cho-tre-em-mo-coi-do-dai-dich-covid-19-20211014224021000.htm,vi-tre-em
Hướng dẫn kỹ năng chăm sóc trẻ trong dịch COVID-19,0,dansinh_vi_tre_em,https://dansinh.dantri.com.vn/vi-tre-em/huong-dan-ky-nang-cham-soc-tre-trong-dich-covid-19-20211014143559000.htm,vi-tre-em
Hà Nội: Đặt mục tiêu giảm 10% số trẻ em bị tử vong do đuối nước vào năm 2025,0,dansinh_vi_tre_em,https://dansinh.dantri.com.vn/vi-tre-em/ha-noi-dat-muc-tieu-giam-10-so-tre-em-bi-tu-vong-do-duoi-nuoc-vao-nam-2025-20211013095453000.htm,vi-tre-em
Trao “Sổ tiết kiệm Công đoàn Việt Nam” cho trẻ em mồ côi dưới 16 tuổi,0,dansinh_vi_tre_em,https://dansinh.dantri.com.vn/vi-tre-em/trao-so-tiet-kiem-cong-doan-viet-nam-cho-tre-em-mo-coi-duoi-16-tuoi-20211012070609000.htm,vi-tre-em
“Trao quyền cho trẻ em gái”,0,dansinh_vi_tre_em,https://dansinh.dantri.com.vn/vi-tre-em/trao-quyen-cho-tre-em-gai-20211011160543000.htm,vi-tre-em
Gia tăng cuộc gọi đến Tổng đài bảo vệ trẻ em 111,0,dansinh_vi_tre_em,https://dansinh.dantri.com.vn/vi-tre-em/gia-tang-cuoc-goi-den-tong-dai-bao-ve-tre-em-111-20211011104734000.htm,vi-tre-em
Nghệ An: Bảo vệ trẻ em trước tai nạn thương tích và đuổi nước,0,dansinh_vi_tre_em,https://dansinh.dantri.com.vn/vi-tre-em/nghe-an-bao-ve-tre-em-truoc-tai-nan-thuong-tich-va-duoi-nuoc-20211103144047000.htm,vi-tre-em
"Nghệ An tăng cường kiểm soát, giảm thiểu tình hình tai nạn, thương tích trẻ em",0,dansinh_vi_tre_em,https://dansinh.dantri.com.vn/vi-tre-em/nghe-an-tang-cuong-kiem-soat-giam-thieu-tinh-hinh-tai-nan-thuong-tich-tre-em-20211102161158000.htm,vi-tre-em
Xây dựng trường học hạnh phúc cho trẻ em,0,dansinh_vi_tre_em,https://dansinh.dantri.com.vn/vi-tre-em/xay-dung-truong-hoc-hanh-phuc-cho-tre-em-20211031225657000.htm,vi-tre-em
"Quỹ ""Bầu ơi"" trao học bổng cho 10 trẻ em có hoàn cảnh đặc biệt khó khăn ở Thanh Hóa",0,dansinh_vi_tre_em,https://dansinh.dantri.com.vn/vi-tre-em/quy-bau-oi-trao-hoc-bong-cho-10-tre-em-co-hoan-canh-dac-biet-kho-khan-o-thanh-hoa-20211031065823000.htm,vi-tre-em
Tiền Giang thăm và tặng quà cho trẻ em mồ côi,0,dansinh_vi_tre_em,https://dansinh.dantri.com.vn/vi-tre-em/tien-giang-tham-va-tang-qua-cho-tre-em-mo-coi-20211030083626000.htm,vi-tre-em
Quảng Nam giảm tỷ lệ lao động trẻ em và người chưa thành niên trái quy định của pháp luật,0,dansinh_vi_tre_em,https://dansinh.dantri.com.vn/vi-tre-em/quang-nam-giam-ty-le-lao-dong-tre-em-va-nguoi-chua-thanh-nien-trai-quy-dinh-cua-phap-luat-20211029125024000.htm,vi-tre-em
Hỗ trợ trẻ em ứng phó khẩn cấp trong đại dịch và sau phục hồi,0,dansinh_vi_tre_em,https://dansinh.dantri.com.vn/vi-tre-em/ho-tro-tre-em-ung-pho-khan-cap-trong-dai-dich-va-sau-phuc-hoi-20211028221259000.htm,vi-tre-em
Trẻ em cần học cách tự bảo vệ trên môi trường mạng,0,dansinh_vi_tre_em,https://dansinh.dantri.com.vn/vi-tre-em/tre-em-can-hoc-cach-tu-bao-ve-tren-moi-truong-mang-20211028155916000.htm,vi-tre-em
Bảo vệ trẻ em trên không gian mạng,0,dansinh_vi_tre_em,https://dansinh.dantri.com.vn/vi-tre-em/bao-ve-tre-em-tren-khong-gian-mang-20211027172245000.htm,vi-tre-em
"Đà Nẵng: Có 15.000 trẻ em, thanh, thiếu niên được nâng cao kiến thức bảo vệ bản thân khỏi nguy cơ xâm hại tình dục trên môi trường mạng",0,dansinh_vi_tre_em,https://dansinh.dantri.com.vn/vi-tre-em/da-nang-co-15000-tre-em-thanh-thieu-nien-duoc-nang-cao-kien-thuc-bao-ve-ban-than-khoi-nguy-co-xam-hai-tinh-duc-tren-moi-truong-mang-20211027141809000.htm,vi-tre-em
Bao giờ trẻ em được tiêm vaccine Covid-19?,0,dansinh_vi_tre_em,https://dansinh.dantri.com.vn/vi-tre-em/bao-gio-tre-em-duoc-tiem-vaccine-covid-19-20211026055617000.htm,vi-tre-em
"Bố mẹ nên dành thời gian vui chơi, trò chuyện cùng con",0,dansinh_vi_tre_em,https://dansinh.dantri.com.vn/vi-tre-em/bo-me-nen-danh-thoi-gian-vui-choi-tro-chuyen-cung-con-20211025004202000.htm,vi-tre-em
Giáo dục tích cực: Cân bằng giữa “thưởng” và “phạt”,0,dansinh_vi_tre_em,https://dansinh.dantri.com.vn/vi-tre-em/giao-duc-tich-cuc-can-bang-giua-thuong-va-phat-20211025004121000.htm,vi-tre-em
"Vinamilk ủng hộ 10 tỷ đồng và góp 1 triệu ly sữa cho trẻ em có hoàn cảnh khó khăn, bị ảnh hưởng bởi dịch Covid-19",0,dansinh_vi_tre_em,https://dansinh.dantri.com.vn/vi-tre-em/vinamilk-ung-ho-10-ty-dong-va-gop-1-trieu-ly-sua-cho-tre-em-co-hoan-canh-kho-khan-bi-anh-huong-boi-dich-covid-19-20211024174221000.htm,vi-tre-em
Đồng Nai trao hỗ trợ trẻ em mồ coi do dịch Covid-19,0,dansinh_vi_tre_em,https://dansinh.dantri.com.vn/vi-tre-em/dong-nai-trao-ho-tro-tre-em-mo-coi-do-dich-covid-19-20211024143544000.htm,vi-tre-em
Kỷ luật tích cực với con một cách lành mạnh và thông minh,0,dansinh_vi_tre_em,https://dansinh.dantri.com.vn/vi-tre-em/ky-luat-tich-cuc-voi-con-mot-cach-lanh-manh-va-thong-minh-20211023195647000.htm,vi-tre-em
15 triệu trẻ sinh non trên toàn thế giới cần được quan tâm sâu sắc,0,dansinh_vi_tre_em,https://dansinh.dantri.com.vn/vi-tre-em/15-trieu-tre-sinh-non-tren-toan-the-gioi-can-duoc-quan-tam-sau-sac-20211116170644000.htm,vi-tre-em
realme đồng hành cùng chiến dịch “Người bạn cho em” dành cho trẻ mồ côi vì đại dịch,0,dansinh_vi_tre_em,https://dansinh.dantri.com.vn/vi-tre-em/realme-dong-hanh-cung-chien-dich-nguoi-ban-cho-em-danh-cho-tre-mo-coi-vi-dai-dich-20211110180329000.htm,vi-tre-em
Ký kết tài trợ cho gần 100 học sinh mồ côi do dịch Covid-19,0,dansinh_vi_tre_em,https://dansinh.dantri.com.vn/vi-tre-em/ky-ket-tai-tro-cho-gan-100-hoc-sinh-mo-coi-do-dich-covid-19-20211111074714000.htm,vi-tre-em
"Đồng hành, hướng dẫn trẻ sử dụng internet an toàn",0,dansinh_vi_tre_em,https://dansinh.dantri.com.vn/vi-tre-em/dong-hanh-huong-dan-tre-su-dung-internet-an-toan-20211108232712000.htm,vi-tre-em
"Các hành vi trừng phạt thể chất, tinh thần đều là bạo lực",0,dansinh_vi_tre_em,https://dansinh.dantri.com.vn/vi-tre-em/cac-hanh-vi-trung-phat-the-chat-tinh-than-deu-la-bao-luc-20211105203711000.htm,vi-tre-em
Việt Nam dẫn đầu khu vực Châu Á về đảm bảo sự tham gia của trẻ em gái,0,dansinh_vi_tre_em,https://dansinh.dantri.com.vn/vi-tre-em/viet-nam-dan-dau-khu-vuc-chau-a-ve-dam-bao-su-tham-gia-cua-tre-em-gai-20211105171243000.htm,vi-tre-em
"""Care to Rise - Yêu thương Nâng bước"" hỗ trợ trẻ em có hoàn cảnh khó khăn bị ảnh hưởng bởi dịch Covid-19",0,dansinh_vi_tre_em,https://dansinh.dantri.com.vn/vi-tre-em/care-to-rise-yeu-thuong-nang-buoc-ho-tro-tre-em-co-hoan-canh-kho-khan-bi-anh-huong-boi-dich-covid-19-20211128205107000.htm,vi-tre-em
"Phụ huynh, thầy cô cùng đồng hành giúp con vượt qua khủng hoảng tâm lý",0,dansinh_vi_tre_em,https://dansinh.dantri.com.vn/vi-tre-em/phu-huynh-thay-co-cung-dong-hanh-giup-con-vuot-qua-khung-hoang-tam-ly-20211128211242000.htm,vi-tre-em
Trẻ em vùng khó khăn được tiếp cận phương pháp giáo dục tiên tiến,0,dansinh_vi_tre_em,https://dansinh.dantri.com.vn/vi-tre-em/tre-em-vung-kho-khan-duoc-tiep-can-phuong-phap-giao-duc-tien-tien-20211128111414000.htm,vi-tre-em
"Lâm Đồng tăng cường công tác bảo vệ, chăm sóc trẻ em trong bối cảnh đại dịch",0,dansinh_vi_tre_em,https://dansinh.dantri.com.vn/vi-tre-em/lam-dong-tang-cuong-cong-tac-bao-ve-cham-soc-tre-em-trong-boi-canh-dai-dich-20211125222914000.htm,vi-tre-em
"Giúp phụ nữ, trẻ em tránh nguy cơ bị bạo lực, xâm hại khi cách ly tại nhà",0,dansinh_vi_tre_em,https://dansinh.dantri.com.vn/vi-tre-em/giup-phu-nu-tre-em-tranh-nguy-co-bi-bao-luc-xam-hai-khi-cach-ly-tai-nha-20211223095759000.htm,vi-tre-em
"Phấn đấu 90% trẻ em khuyết tật được tiếp cận dịch vụ bảo vệ, chăm sóc, giáo dục tại cộng đồng",0,dansinh_vi_tre_em,https://dansinh.dantri.com.vn/vi-tre-em/phan-dau-90-tre-em-khuyet-tat-duoc-tiep-can-dich-vu-bao-ve-cham-soc-giao-duc-tai-cong-dong-20211223091616000.htm,vi-tre-em
Bến Tre quan tâm chăm sóc cho trẻ em trong đại dịch Covid-19,0,dansinh_vi_tre_em,https://dansinh.dantri.com.vn/vi-tre-em/ben-tre-quan-tam-cham-soc-cho-tre-em-trong-dai-dich-covid-19-20211122230429000.htm,vi-tre-em
Bảo vệ sức khỏe tâm thần cho trẻ em và thanh thiếu niên,0,dansinh_vi_tre_em,https://dansinh.dantri.com.vn/vi-tre-em/bao-ve-suc-khoe-tam-than-cho-tre-em-va-thanh-thieu-nien-20211117151145000.htm,vi-tre-em
Cùng con vượt qua những ảnh hưởng của Covid-19,0,dansinh_vi_tre_em,https://dansinh.dantri.com.vn/vi-tre-em/cung-con-vuot-qua-nhung-anh-huong-cua-covid-19-20211115231233000.htm,vi-tre-em
Trao quyền tham gia cho trẻ em ngay từ nhỏ,0,dansinh_vi_tre_em,https://dansinh.dantri.com.vn/vi-tre-em/trao-quyen-tham-gia-cho-tre-em-ngay-tu-nho-20211113153657000.htm,vi-tre-em
Tiền Giang tiếp sức đến trường cho học sinh huyện Cai Lậy và Cái Bè,0,dansinh_vi_tre_em,https://dansinh.dantri.com.vn/vi-tre-em/tien-giang-tiep-suc-den-truong-cho-hoc-sinh-huyen-cai-lay-va-cai-be-20211118163109000.htm,vi-tre-em
"5,7 triệu USD nâng cao kiến thức, kỹ năng giúp trẻ em chống chịu rủi ro thiên tai",0,dansinh_vi_tre_em,https://dansinh.dantri.com.vn/vi-tre-em/57-trieu-usd-nang-cao-kien-thuc-ky-nang-giup-tre-em-chong-chiu-rui-ro-thien-tai-20211118070753000.htm,vi-tre-em
Mở rộng Dự án Làm cha mẹ vì sự phát triển toàn diện trẻ thơ,0,dansinh_vi_tre_em,https://dansinh.dantri.com.vn/vi-tre-em/mo-rong-du-an-lam-cha-me-vi-su-phat-trien-toan-dien-tre-tho-20211210162207000.htm,vi-tre-em
Công bố kết quả điều tra các mục tiêu phát triển trẻ em và phụ nữ,0,dansinh_vi_tre_em,https://dansinh.dantri.com.vn/vi-tre-em/cong-bo-ket-qua-dieu-tra-cac-muc-tieu-phat-trien-tre-em-va-phu-nu-20211208144905000.htm,vi-tre-em
Cần trang bị kỹ năng để trẻ tự bảo vệ mình,0,dansinh_vi_tre_em,https://dansinh.dantri.com.vn/vi-tre-em/can-trang-bi-ky-nang-de-tre-tu-bao-ve-minh-20211206164051000.htm,vi-tre-em
Ninh Bình vận động hơn 5 tỷ đồng ủng hộ Chương trình “Sóng và máy tính cho em”,0,dansinh_vi_tre_em,https://dansinh.dantri.com.vn/vi-tre-em/ninh-binh-van-dong-hon-5-ty-dong-ung-ho-chuong-trinh-song-va-may-tinh-cho-em-20211204160217000.htm,vi-tre-em
Vì nhịp thở Việt Nam đã gây quỹ hơn 27 tỷ đồng,0,dansinh_vi_tre_em,https://dansinh.dantri.com.vn/vi-tre-em/vi-nhip-tho-viet-nam-da-gay-quy-hon-27-ty-dong-20211202170756000.htm,vi-tre-em
Trao tặng học bổng cho học sinh vượt khó,0,dansinh_vi_tre_em,https://dansinh.dantri.com.vn/vi-tre-em/trao-tang-hoc-bong-cho-hoc-sinh-vuot-kho-20211201151933000.htm,vi-tre-em
Quyết liệt vào cuộc để xóa bỏ lao động trẻ em,0,dansinh_vi_tre_em,https://dansinh.dantri.com.vn/vi-tre-em/quyet-liet-vao-cuoc-de-xoa-bo-lao-dong-tre-em-20211201140601000.htm,vi-tre-em
Hỗ trợ nuôi dưỡng trẻ mồ côi do dịch Covid-19,0,dansinh_vi_tre_em,https://dansinh.dantri.com.vn/vi-tre-em/ho-tro-nuoi-duong-tre-mo-coi-do-dich-covid-19-20211201151411000.htm,vi-tre-em
Quảng Bình trao tặng 200 suất đồ ấm cho trẻ em các xã đặc biệt khó khăn,0,dansinh_vi_tre_em,https://dansinh.dantri.com.vn/vi-tre-em/quang-binh-trao-tang-200-suat-do-am-cho-tre-em-cac-xa-dac-biet-kho-khan-20211226152152000.htm,vi-tre-em
Hơn 100 tỷ đồng bảo trợ cho 682 trẻ mồ côi do dịch bệnh Covid-19 tại TP.HCM đến năm 18 tuổi,0,dansinh_vi_tre_em,https://dansinh.dantri.com.vn/vi-tre-em/hon-100-ty-dong-bao-tro-cho-682-tre-mo-coi-do-dich-benh-covid-19-tai-tphcm-den-nam-18-tuoi-20211221220946000.htm,vi-tre-em
Xóa bỏ bắt nạt trẻ em trong môi trường mạng và tại trường học,0,dansinh_vi_tre_em,https://dansinh.dantri.com.vn/vi-tre-em/xoa-bo-bat-nat-tre-em-trong-moi-truong-mang-va-tai-truong-hoc-20211221084313000.htm,vi-tre-em
TP.HCM tặng quà và học bổng cho 105 trẻ mồ côi,0,dansinh_vi_tre_em,https://dansinh.dantri.com.vn/vi-tre-em/tphcm-tang-qua-va-hoc-bong-cho-105-tre-mo-coi-20211216153509000.htm,vi-tre-em
Hướng dẫn trẻ sử dụng mạng xã hội an toàn,0,dansinh_vi_tre_em,https://dansinh.dantri.com.vn/vi-tre-em/huong-dan-tre-su-dung-mang-xa-hoi-an-toan-20211214094354000.htm,vi-tre-em
Bố mẹ cần tìm cách xử lý hành vi xấu của con,0,dansinh_vi_tre_em,https://dansinh.dantri.com.vn/vi-tre-em/bo-me-can-tim-cach-xu-ly-hanh-vi-xau-cua-con-20211213225026000.htm,vi-tre-em
Hướng dẫn trẻ xây dựng và thực hiện những thói quen tốt cho trẻ,0,dansinh_vi_tre_em,https://dansinh.dantri.com.vn/vi-tre-em/huong-dan-tre-xay-dung-va-thuc-hien-nhung-thoi-quen-tot-cho-tre-20211213222736000.htm,vi-tre-em
Phó Chủ tịch nước Võ Thị Ánh Xuân gặp mặt những tấm lòng vàng tiêu biểu 2021,0,dansinh_vi_tre_em,https://dansinh.dantri.com.vn/vi-tre-em/pho-chu-tich-nuoc-vo-thi-anh-xuan-gap-mat-nhung-tam-long-vang-tieu-bieu-2021-20220109210422000.htm,vi-tre-em
Bộ LĐ-TB&XH đề nghị xử lý nghiêm hành vi vi phạm pháp luật của các cơ sở trợ giúp xã hội,0,dansinh_vi_tre_em,https://dansinh.dantri.com.vn/vi-tre-em/bo-ld-tbxh-de-nghi-xu-ly-nghiem-hanh-vi-vi-pham-phap-luat-cua-cac-co-so-tro-giup-xa-hoi-20220109124312000.htm,vi-tre-em
Làng trẻ em SOS Vinh kỷ niệm 30 năm ngày thành lập,0,dansinh_vi_tre_em,https://dansinh.dantri.com.vn/vi-tre-em/lang-tre-em-sos-vinh-ky-niem-30-nam-ngay-thanh-lap-20220109090102000.htm,vi-tre-em
Cha mẹ cố ý bỏ rơi con bị phạt 20 đến 25 triệu đồng,0,dansinh_vi_tre_em,https://dansinh.dantri.com.vn/vi-tre-em/cha-me-co-y-bo-roi-con-bi-phat-20-den-25-trieu-dong-20220107145421000.htm,vi-tre-em
Phụ huynh nên học cách tôn trọng sở thích của con,0,dansinh_vi_tre_em,https://dansinh.dantri.com.vn/vi-tre-em/phu-huynh-nen-hoc-cach-ton-trong-so-thich-cua-con-20220106103222000.htm,vi-tre-em
"Chương trình ""Mùa xuân cho em"" lần thứ 15 dự kiến tiếp nhận khoảng 80 tỷ đồng",0,dansinh_vi_tre_em,https://dansinh.dantri.com.vn/vi-tre-em/chuong-trinh-mua-xuan-cho-em-lan-thu-15-du-kien-tiep-nhan-khoang-80-ty-dong-20220105221305000.htm,vi-tre-em
"Từ 1/1/2022, bạo lực với trẻ em có thể bị xử phạt lên tới 20 triệu đồng",0,dansinh_vi_tre_em,https://dansinh.dantri.com.vn/vi-tre-em/tu-112022-bao-luc-voi-tre-em-co-the-bi-xu-phat-len-toi-20-trieu-dong-20220106082307000.htm,vi-tre-em
"Ninh Bình ban hành văn bản tăng cường phòng, chống bạo lực, xử lý hành vi hành hạ, xâm hại trẻ em",0,dansinh_vi_tre_em,https://dansinh.dantri.com.vn/vi-tre-em/ninh-binh-ban-hanh-van-ban-tang-cuong-phong-chong-bao-luc-xu-ly-hanh-vi-hanh-ha-xam-hai-tre-em-20220105055940000.htm,vi-tre-em
Acecook Việt Nam đồng hành cùng Quỹ Bảo trợ trẻ em Việt Nam để hỗ trợ trẻ em có hoàn cảnh khó khăn,0,dansinh_vi_tre_em,https://dansinh.dantri.com.vn/vi-tre-em/acecook-viet-nam-dong-hanh-cung-quy-bao-tro-tre-em-viet-nam-de-ho-tro-tre-em-co-hoan-canh-kho-khan-20220105094813000.htm,vi-tre-em
"Tăng cường giải pháp bảo vệ, chăm sóc trẻ em bị ảnh hưởng bởi dịch COVID-19",0,dansinh_vi_tre_em,https://dansinh.dantri.com.vn/vi-tre-em/tang-cuong-giai-phap-bao-ve-cham-soc-tre-em-bi-anh-huong-boi-dich-covid-19-20211231185435000.htm,vi-tre-em
"Xử lý nghiêm đối tượng hành hạ, xâm hại trẻ em",0,dansinh_vi_tre_em,https://dansinh.dantri.com.vn/vi-tre-em/xu-ly-nghiem-doi-tuong-hanh-ha-xam-hai-tre-em-20211230193119000.htm,vi-tre-em
Đồng Nai mang Tết đến với trẻ em khó khăn,0,dansinh_vi_tre_em,https://dansinh.dantri.com.vn/vi-tre-em/dong-nai-mang-tet-den-voi-tre-em-kho-khan-20220127140304000.htm,vi-tre-em
1 triệu “Bữa ăn trọn vẹn” cho những hoàn cảnh khó khăn,0,dansinh_vi_tre_em,https://dansinh.dantri.com.vn/vi-tre-em/1-trieu-bua-an-tron-ven-cho-nhung-hoan-canh-kho-khan-20220126185359000.htm,vi-tre-em
Thứ trưởng Nguyễn Thị Hà đánh giá cao những kết quả Cục Trẻ em đã đạt được trong năm 2021,0,dansinh_vi_tre_em,https://dansinh.dantri.com.vn/vi-tre-em/thu-truong-nguyen-thi-ha-danh-gia-cao-nhung-ket-qua-cuc-tre-em-da-dat-duoc-trong-nam-2021-20220126192146000.htm,vi-tre-em
Đại diện Bộ Lao động-Thương binh và Xã hội thăm trao tiền hỗ trợ điều trị cho bé gái 3 tuổi bị bạo hành ở huyện Thạch Thất – Hà Nội,0,dansinh_vi_tre_em,https://dansinh.dantri.com.vn/vi-tre-em/dai-dien-bo-lao-dong-thuong-binh-va-xa-hoi-tham-trao-tien-ho-tro-dieu-tri-cho-be-gai-3-tuoi-bi-bao-hanh-o-huyen-thach-that-ha-noi-20220126155825000.htm,vi-tre-em
"""Yêu thương nâng bước"" hỗ trợ, bảo vệ và tiếp thêm sức mạnh cho 2.345 trẻ mồ côi do đại dịch Covid-19 tại TP. HCM",0,dansinh_vi_tre_em,https://dansinh.dantri.com.vn/vi-tre-em/yeu-thuong-nang-buoc-ho-tro-bao-ve-va-tiep-them-suc-manh-cho-2345-tre-mo-coi-do-dai-dich-covid-19-tai-tp-hcm-20220126141932000.htm,vi-tre-em
Chung tay hỗ trợ áo ấm cho trẻ em vùng cao,0,dansinh_vi_tre_em,https://dansinh.dantri.com.vn/vi-tre-em/chung-tay-ho-tro-ao-am-cho-tre-em-vung-cao-20220125184222000.htm,vi-tre-em
"Quảng Nam tăng cường giải pháp bảo vệ, chăm sóc trẻ em",0,dansinh_vi_tre_em,https://dansinh.dantri.com.vn/vi-tre-em/quang-nam-tang-cuong-giai-phap-bao-ve-cham-soc-tre-em-20220124143418000.htm,vi-tre-em
"Tiền Giang thăm, tặng quà trẻ em có hoàn cảnh đặc biệt khó khăn dịp tết Nguyên đán 2022",0,dansinh_vi_tre_em,https://dansinh.dantri.com.vn/vi-tre-em/tien-giang-tham-tang-qua-tre-em-co-hoan-canh-dac-biet-kho-khan-dip-tet-nguyen-dan-2022-20220122215749000.htm,vi-tre-em
Mùa đông ấm cho trẻ em vùng cao,0,dansinh_vi_tre_em,https://dansinh.dantri.com.vn/vi-tre-em/mua-dong-am-cho-tre-em-vung-cao-20220121211332000.htm,vi-tre-em
Đề nghị xác minh và xử lý nghiêm vụ bé gái nghi bị đinh găm vào đầu,0,dansinh_vi_tre_em,https://dansinh.dantri.com.vn/vi-tre-em/de-nghi-xac-minh-va-xu-ly-nghiem-vu-be-gai-nghi-bi-dinh-gam-vao-dau-20220119214329000.htm,vi-tre-em
Tết ấm no cho trẻ em bị ảnh hưởng bởi HIV/AIDS,0,dansinh_vi_tre_em,https://dansinh.dantri.com.vn/vi-tre-em/tet-am-no-cho-tre-em-bi-anh-huong-boi-hivaids-20220117150925000.htm,vi-tre-em
Cần Thơ trao 50 sổ tiết kiệm và quà cho trẻ em mồ côi do COVID-19,0,dansinh_vi_tre_em,https://dansinh.dantri.com.vn/vi-tre-em/can-tho-trao-50-so-tiet-kiem-va-qua-cho-tre-em-mo-coi-do-covid-19-20220213175349000.htm,vi-tre-em
Mừng tuổi bằng sách: Truyền cảm hứng đọc sách cho trẻ em,0,dansinh_vi_tre_em,https://dansinh.dantri.com.vn/vi-tre-em/mung-tuoi-bang-sach-truyen-cam-hung-doc-sach-cho-tre-em-20220210215130000.htm,vi-tre-em
"Xử lý nghiêm minh để răn đe các vụ bạo hành, xâm hại trẻ em",0,dansinh_vi_tre_em,https://dansinh.dantri.com.vn/vi-tre-em/xu-ly-nghiem-minh-de-ran-de-cac-vu-bao-hanh-xam-hai-tre-em-20220210213406000.htm,vi-tre-em
Tiếp tục chung tay hỗ trợ trẻ em bị ảnh hưởng bởi đại dịch Covid-19,0,dansinh_vi_tre_em,https://dansinh.dantri.com.vn/vi-tre-em/tiep-tuc-chung-tay-ho-tro-tre-em-bi-anh-huong-boi-dai-dich-covid-19-20220210161038000.htm,vi-tre-em
Bộ trưởng Đào Ngọc Dung: “Mong muốn gia đình hãy dành sự quan tâm tốt nhất cho trẻ em”,0,dansinh_vi_tre_em,https://dansinh.dantri.com.vn/vi-tre-em/bo-truong-dao-ngoc-dung-mong-muon-gia-dinh-hay-danh-su-quan-tam-tot-nhat-cho-tre-em-20220208184252000.htm,vi-tre-em
Nâng bước ước mơ của trẻ khuyết tật,0,dansinh_vi_tre_em,https://dansinh.dantri.com.vn/vi-tre-em/nang-buoc-uoc-mo-cua-tre-khuyet-tat-20220203154130000.htm,vi-tre-em
"Vượt qua đại dịch Covid-19, ngành LĐ-TB&XH Bình Dương đảm bảo an sinh xã hội",0,dansinh_vi_tre_em,https://dansinh.dantri.com.vn/vi-tre-em/vuot-qua-dai-dich-covid-19-nganh-ld-tbxh-binh-duong-dam-bao-an-sinh-xa-hoi-20220131221951000.htm,vi-tre-em
Dành 530.000 USD để tăng cường hiệu quả hệ thống bảo vệ trẻ em,0,dansinh_vi_tre_em,https://dansinh.dantri.com.vn/vi-tre-em/danh-530000-usd-de-tang-cuong-hieu-qua-he-thong-bao-ve-tre-em-20220127203227000.htm,vi-tre-em
"Thái Bình trao kinh phí chương trình ""Mẹ đỡ đầu"" cho trẻ em mồ côi",0,dansinh_vi_tre_em,https://dansinh.dantri.com.vn/vi-tre-em/thai-binh-trao-kinh-phi-chuong-trinh-me-do-dau-cho-tre-em-mo-coi-20220302163657000.htm,vi-tre-em
Đà Nẵng phấn đấu 85% trẻ em đến 8 tuổi được tiếp cận các dịch vụ hỗ trợ chăm sóc phát triển toàn diện,0,dansinh_vi_tre_em,https://dansinh.dantri.com.vn/vi-tre-em/da-nang-phan-dau-85-tre-em-den-8-tuoi-duoc-tiep-can-cac-dich-vu-ho-tro-cham-soc-phat-trien-toan-dien-20220302092927000.htm,vi-tre-em
Báo động tình trạng trầm cảm ở trẻ em,0,dansinh_vi_tre_em,https://dansinh.dantri.com.vn/vi-tre-em/bao-dong-tinh-trang-tram-cam-o-tre-em-20220228103030000.htm,vi-tre-em
Khám sàng lọc miễn phí cho trẻ em bị ảnh hưởng bởi dịch Covid-19,0,dansinh_vi_tre_em,https://dansinh.dantri.com.vn/vi-tre-em/kham-sang-loc-mien-phi-cho-tre-em-bi-anh-huong-boi-dich-covid-19-20220226214043000.htm,vi-tre-em
"Đà Nẵng tăng cường các giải pháp bảo vệ, chăm sóc trẻ em bị ảnh hưởng bởi dịch COVID-19",0,dansinh_vi_tre_em,https://dansinh.dantri.com.vn/vi-tre-em/da-nang-tang-cuong-cac-giai-phap-bao-ve-cham-soc-tre-em-bi-anh-huong-boi-dich-covid-19-20220226141435000.htm,vi-tre-em
Những phần quà ý nghĩa dành tặng trẻ em Đại Bình,0,dansinh_vi_tre_em,https://dansinh.dantri.com.vn/vi-tre-em/nhung-phan-qua-y-nghia-danh-tang-tre-em-dai-binh-20220224151621000.htm,vi-tre-em
"Bộ trưởng Đào Ngọc Dung: Tăng cường hơn nữa cơ chế phối hợp giữa các bộ, ngành trong công tác bảo vệ, chăm sóc và giáo dục trẻ em",0,dansinh_vi_tre_em,https://dansinh.dantri.com.vn/vi-tre-em/bo-truong-dao-ngoc-dung-tang-cuong-hon-nua-co-che-phoi-hop-giua-cac-bo-nganh-trong-cong-tac-bao-ve-cham-soc-va-giao-duc-tre-em-20220222230120000.htm,vi-tre-em
"Thanh Hóa: 21.419 trẻ em được thăm hỏi, tặng quà trong dịp Tết Nhâm Dần",0,dansinh_vi_tre_em,https://dansinh.dantri.com.vn/vi-tre-em/thanh-hoa-21419-tre-em-duoc-tham-hoi-tang-qua-trong-dip-tet-nham-dan-20220220222737000.htm,vi-tre-em
4 Bộ ký kết phối hợp cùng chăm sóc toàn diện cho trẻ em,0,dansinh_vi_tre_em,https://dansinh.dantri.com.vn/vi-tre-em/4-bo-ky-ket-phoi-hop-cung-cham-soc-toan-dien-cho-tre-em-20220217170429000.htm,vi-tre-em
Nỗ lực chăm lo trẻ em bị ảnh hưởng bởi dịch Covid-19,0,dansinh_vi_tre_em,https://dansinh.dantri.com.vn/vi-tre-em/no-luc-cham-lo-tre-em-bi-anh-huong-boi-dich-covid-19-20220217095457000.htm,vi-tre-em
Mang niềm vui đến với trẻ em khó khăn tỉnh Kiên Giang,0,dansinh_vi_tre_em,https://dansinh.dantri.com.vn/vi-tre-em/mang-niem-vui-den-voi-tre-em-kho-khan-tinh-kien-giang-20220217122259000.htm,vi-tre-em
