free_text,label_id,source,url,category
Thiếu vắng những sáng tác dành cho trẻ em mang hơi thở thời đại,0,dansinh_vi_tre_em,https://dansinh.dantri.com.vn/vi-tre-em/thieu-vang-nhung-sang-tac-danh-cho-tre-em-mang-hoi-tho-thoi-dai-20240613214940143.htm,vi-tre-em
Đắk Lắk: Tạo điều kiện tốt để trẻ em phát triển trong môi trường an toàn,0,dansinh_vi_tre_em,https://dansinh.dantri.com.vn/vi-tre-em/dak-lak-tao-dieu-kien-tot-de-tre-em-phat-trien-trong-moi-truong-an-toan-20240613213359421.htm,vi-tre-em
Những lưu ý khi “sĩ tử” bước vào kỳ thi tốt nghiệp THPT,0,dansinh_vi_tre_em,https://dansinh.dantri.com.vn/vi-tre-em/nhung-luu-y-khi-si-tu-buoc-vao-ky-thi-tot-nghiep-thpt-20240613214458629.htm,vi-tre-em
"Giảm giá vé tàu cho học sinh và thân nhân đi cùng khi thi đại học, nhập học",0,dansinh_vi_tre_em,https://dansinh.dantri.com.vn/vi-tre-em/giam-gia-ve-tau-cho-hoc-sinh-va-than-nhan-di-cung-khi-thi-dai-hoc-nhap-hoc-20240613081400670.htm,vi-tre-em
Ám ảnh bạo lực học đường,0,dansinh_vi_tre_em,https://dansinh.dantri.com.vn/vi-tre-em/am-anh-bao-luc-hoc-duong-20240611084345989.htm,vi-tre-em
Những người mẹ mang sắc phục xanh,0,dansinh_vi_tre_em,https://dansinh.dantri.com.vn/vi-tre-em/nhung-nguoi-me-mang-sac-phuc-xanh-20240612114745037.htm,vi-tre-em
Cập nhật ngày công bố điểm thi và điểm chuẩn lớp 10 của 63 tỉnh/thành,0,dansinh_vi_tre_em,https://dansinh.dantri.com.vn/vi-tre-em/cap-nhat-ngay-cong-bo-diem-thi-va-diem-chuan-lop-10-cua-63-tinhthanh-20240612071243213.htm,vi-tre-em
Làm báo về trẻ em phải có tấm lòng yêu trẻ,0,dansinh_vi_tre_em,https://dansinh.dantri.com.vn/vi-tre-em/lam-bao-ve-tre-em-phai-co-tam-long-yeu-tre-20240612112812406.htm,vi-tre-em
"Đề nghị xe ô tô chở học sinh lắp thiết bị cảnh báo, chống bỏ quên trẻ em",0,dansinh_vi_tre_em,https://dansinh.dantri.com.vn/vi-tre-em/de-nghi-xe-o-to-cho-hoc-sinh-lap-thiet-bi-canh-bao-chong-bo-quen-tre-em-20240612070625728.htm,vi-tre-em
"Phổ biến, giáo dục pháp luật nhằm giảm thiểu vi phạm ở thanh, thiếu niên",0,dansinh_vi_tre_em,https://dansinh.dantri.com.vn/vi-tre-em/pho-bien-giao-duc-phap-luat-nham-giam-thieu-vi-pham-o-thanh-thieu-nien-20240611092153105.htm,vi-tre-em
Làm cha mẹ là một “nghề” vô cùng đặc biệt,0,dansinh_vi_tre_em,https://dansinh.dantri.com.vn/vi-tre-em/lam-cha-me-la-mot-nghe-vo-cung-dac-biet-20240611151135438.htm,vi-tre-em
Nam sinh đỗ đại học hàng đầu ở Mỹ nhờ đam mê công nghệ từ nhỏ,0,dansinh_vi_tre_em,https://dansinh.dantri.com.vn/vi-tre-em/nam-sinh-do-dai-hoc-hang-dau-o-my-nho-dam-me-cong-nghe-tu-nho-20240610171417261.htm,vi-tre-em
"Liên thông thủ tục đăng ký khai sinh, thường trú cho trẻ dưới 6 tuổi",0,dansinh_vi_tre_em,https://dansinh.dantri.com.vn/vi-tre-em/lien-thong-thu-tuc-dang-ky-khai-sinh-thuong-tru-cho-tre-duoi-6-tuoi-20240611102959971.htm,vi-tre-em
"Kiểm tra, xác minh vụ việc 'bé gái bị đánh, làm nhục ở huyện Chương Mỹ'",0,dansinh_vi_tre_em,https://dansinh.dantri.com.vn/vi-tre-em/kiem-tra-xac-minh-vu-viec-be-gai-bi-danh-lam-nhuc-o-huyen-chuong-my-20240610151140415.htm,vi-tre-em
Nhiều hoạt động thiết thực dành cho trẻ em dịp hè,0,dansinh_vi_tre_em,https://dansinh.dantri.com.vn/vi-tre-em/nhieu-hoat-dong-thiet-thuc-danh-cho-tre-em-dip-he-20240610110032109.htm,vi-tre-em
Quả vải rất tốt nhưng trẻ em không nên ăn quá nhiều,0,dansinh_vi_tre_em,https://dansinh.dantri.com.vn/vi-tre-em/qua-vai-rat-tot-nhung-tre-em-khong-nen-an-qua-nhieu-20240609143041812.htm,vi-tre-em
Thẻ Căn cước cho trẻ em 0-6 tuổi gồm những thông tin gì?,0,dansinh_vi_tre_em,https://dansinh.dantri.com.vn/vi-tre-em/the-can-cuoc-cho-tre-em-0-6-tuoi-gom-nhung-thong-tin-gi-20240609131849295.htm,vi-tre-em
"Sách thiếu nhi: Đa dạng, phong phú, chiều lòng độc giả nhí",0,dansinh_vi_tre_em,https://dansinh.dantri.com.vn/vi-tre-em/sach-thieu-nhi-da-dang-phong-phu-chieu-long-doc-gia-nhi-20240608210419675.htm,vi-tre-em
Lan tỏa mô hình dạy bơi miễn phí cho trẻ em,0,dansinh_vi_tre_em,https://dansinh.dantri.com.vn/vi-tre-em/lan-toa-mo-hinh-day-boi-mien-phi-cho-tre-em-20240604092945464.htm,vi-tre-em
"Trại giam toàn tội phạm, có khi lại đào tạo đứa trẻ thành chuyên nghiệp hơn",0,dansinh_vi_tre_em,https://dansinh.dantri.com.vn/vi-tre-em/trai-giam-toan-toi-pham-co-khi-lai-dao-tao-dua-tre-thanh-chuyen-nghiep-hon-20240608164214490.htm,vi-tre-em
Hơn 1/4 trẻ em dưới 5 tuổi trên toàn cầu đang bị thiếu lương thực,0,dansinh_vi_tre_em,https://dansinh.dantri.com.vn/vi-tre-em/hon-14-tre-em-duoi-5-tuoi-tren-toan-cau-dang-bi-thieu-luong-thuc-20240607165021853.htm,vi-tre-em
Đề nghị xây dựng Nghị quyết Quốc hội về phổ cập giáo dục mầm non,0,dansinh_vi_tre_em,https://dansinh.dantri.com.vn/vi-tre-em/de-nghi-xay-dung-nghi-quyet-quoc-hoi-ve-pho-cap-giao-duc-mam-non-20240607124625136.htm,vi-tre-em
Cần sớm luật hóa quy định an toàn cho trẻ trên ôtô,0,dansinh_vi_tre_em,https://dansinh.dantri.com.vn/vi-tre-em/can-som-luat-hoa-quy-dinh-an-toan-cho-tre-tren-oto-20240606100023872.htm,vi-tre-em
Đề xuất 12 biện pháp xử lý thay hình phạt người chưa thành niên phạm tội,0,dansinh_vi_tre_em,https://dansinh.dantri.com.vn/vi-tre-em/de-xuat-12-bien-phap-xu-ly-thay-hinh-phat-nguoi-chua-thanh-nien-pham-toi-20240607002518128.htm,vi-tre-em
Thí sinh tại nhiều địa phương đã hoàn thành kỳ thi tuyển sinh vào lớp 10,0,dansinh_vi_tre_em,https://dansinh.dantri.com.vn/vi-tre-em/thi-sinh-tai-nhieu-dia-phuong-da-hoan-thanh-ky-thi-tuyen-sinh-vao-lop-10-20240606101401312.htm,vi-tre-em
Nhật Bản mở rộng độ tuổi trẻ em nhận trợ cấp hằng tháng,0,dansinh_vi_tre_em,https://dansinh.dantri.com.vn/vi-tre-em/nhat-ban-mo-rong-do-tuoi-tre-em-nhan-tro-cap-hang-thang-20240606103731858.htm,vi-tre-em
Trẻ em sẽ được tiêm 4 loại vaccine miễn phí đến năm 2030,0,dansinh_vi_tre_em,https://dansinh.dantri.com.vn/vi-tre-em/tre-em-se-duoc-tiem-4-loai-vaccine-mien-phi-den-nam-2030-20240605214227777.htm,vi-tre-em
Đà Nẵng trao dụng cụ phục hồi chức năng cho trẻ em khuyết tật,0,dansinh_vi_tre_em,https://dansinh.dantri.com.vn/vi-tre-em/da-nang-trao-dung-cu-phuc-hoi-chuc-nang-cho-tre-em-khuyet-tat-20240605132511693.htm,vi-tre-em
Trẻ em đang phụ thuộc ngày càng nhiều vào các thiết bị điện tử,0,dansinh_vi_tre_em,https://dansinh.dantri.com.vn/vi-tre-em/tre-em-dang-phu-thuoc-ngay-cang-nhieu-vao-cac-thiet-bi-dien-tu-20240603100554781.htm,vi-tre-em
Hơn 1.000 học sinh khuyết tật tại TPHCM được tuyển thẳng vào lớp 10,0,dansinh_vi_tre_em,https://dansinh.dantri.com.vn/vi-tre-em/hon-1000-hoc-sinh-khuyet-tat-tai-tphcm-duoc-tuyen-thang-vao-lop-10-20240605091507101.htm,vi-tre-em
Tỷ lệ trẻ em dưới 5 tuổi suy dinh dưỡng thấp còi còn cao,0,dansinh_vi_tre_em,https://dansinh.dantri.com.vn/vi-tre-em/ty-le-tre-em-duoi-5-tuoi-suy-dinh-duong-thap-coi-con-cao-20240529160145106.htm,vi-tre-em
"Thuốc lá điện tử: Bộ Y tế đề xuất cấm, Bộ Công Thương muốn thí điểm quản",0,dansinh_vi_tre_em,https://dansinh.dantri.com.vn/vi-tre-em/thuoc-la-dien-tu-bo-y-te-de-xuat-cam-bo-cong-thuong-muon-thi-diem-quan-20240604094715154.htm,vi-tre-em
426 học sinh khuyết tật được tuyển thẳng vào lớp 10 tại Hà Nội,0,dansinh_vi_tre_em,https://dansinh.dantri.com.vn/vi-tre-em/426-hoc-sinh-khuyet-tat-duoc-tuyen-thang-vao-lop-10-tai-ha-noi-20240604211418008.htm,vi-tre-em
Quảng Bình: Dành những gì tốt đẹp nhất cho trẻ em,0,dansinh_vi_tre_em,https://dansinh.dantri.com.vn/vi-tre-em/quang-binh-danh-nhung-gi-tot-dep-nhat-cho-tre-em-20240604100420977.htm,vi-tre-em
“Vì lợi ích trăm năm…”,0,dansinh_vi_tre_em,https://dansinh.dantri.com.vn/vi-tre-em/vi-loi-ich-tram-nam-20240512111623631.htm,vi-tre-em
Yêu thương và bảo vệ trẻ em bằng hành động cụ thể,0,dansinh_vi_tre_em,https://dansinh.dantri.com.vn/vi-tre-em/yeu-thuong-va-bao-ve-tre-em-bang-hanh-dong-cu-the-20240603124855473.htm,vi-tre-em
"Đắk Lắk tuyên truyền phòng, chống tác hại thuốc lá đối với trẻ em",0,dansinh_vi_tre_em,https://dansinh.dantri.com.vn/vi-tre-em/dak-lak-tuyen-truyen-phong-chong-tac-hai-thuoc-la-doi-voi-tre-em-20240603114703979.htm,vi-tre-em
"Số ca bệnh ho gà có dấu hiệu gia tăng, chủ yếu là trẻ chưa tiêm vaccine",0,dansinh_vi_tre_em,https://dansinh.dantri.com.vn/vi-tre-em/so-ca-benh-ho-ga-co-dau-hieu-gia-tang-chu-yeu-la-tre-chua-tiem-vaccine-20240602224026202.htm,vi-tre-em
Điều chỉnh giảm giá sách giáo khoa năm học 2024-2025,0,dansinh_vi_tre_em,https://dansinh.dantri.com.vn/vi-tre-em/dieu-chinh-giam-gia-sach-giao-khoa-nam-hoc-2024-2025-20240602104529767.htm,vi-tre-em
"Hoa hậu Ngọc Hân trao giải ""Ngôi nhà mơ ước"" cho các họa sĩ nhí",0,dansinh_vi_tre_em,https://dansinh.dantri.com.vn/vi-tre-em/hoa-hau-ngoc-han-trao-giai-ngoi-nha-mo-uoc-cho-cac-hoa-si-nhi-20240601170448303.htm,vi-tre-em
Hành động quyết liệt và dành nguồn lực lớn hơn nữa cho trẻ em,0,dansinh_vi_tre_em,https://dansinh.dantri.com.vn/vi-tre-em/hanh-dong-quyet-liet-va-danh-nguon-luc-lon-hon-nua-cho-tre-em-20240601103302134.htm,vi-tre-em
Thi tốt nghiệp THPT 2024: Thí sinh chọn bài thi Khoa học Xã hội chiếm 63%,0,dansinh_vi_tre_em,https://dansinh.dantri.com.vn/vi-tre-em/thi-tot-nghiep-thpt-2024-thi-sinh-chon-bai-thi-khoa-hoc-xa-hoi-chiem-63-20240601113623028.htm,vi-tre-em
"Đề xuất học sinh, sinh viên dân tộc thiểu số được miễn học phí",0,dansinh_vi_tre_em,https://dansinh.dantri.com.vn/vi-tre-em/de-xuat-hoc-sinh-sinh-vien-dan-toc-thieu-so-duoc-mien-hoc-phi-20240601111259736.htm,vi-tre-em
"""Thực tâm, thực lòng, thực chất"" trong bảo vệ, giáo dục trẻ em khuyết tật",0,dansinh_vi_tre_em,https://dansinh.dantri.com.vn/vi-tre-em/thuc-tam-thuc-long-thuc-chat-trong-bao-ve-giao-duc-tre-em-khuyet-tat-20240531143022280.htm,vi-tre-em
"Kể chuyện văn hóa, lịch sử qua game",0,dansinh_vi_tre_em,https://dansinh.dantri.com.vn/vi-tre-em/ke-chuyen-van-hoa-lich-su-qua-game-20240530102036876.htm,vi-tre-em
Thuốc lá điện tử: Trào lưu “thời thượng” nguy hại của giới trẻ,0,dansinh_vi_tre_em,https://dansinh.dantri.com.vn/vi-tre-em/thuoc-la-dien-tu-trao-luu-thoi-thuong-nguy-hai-cua-gioi-tre-20240530111054735.htm,vi-tre-em
"Quảng Nam yêu cầu điều tra, làm rõ các vụ việc trẻ em bị đuối nước",0,dansinh_vi_tre_em,https://dansinh.dantri.com.vn/vi-tre-em/quang-nam-yeu-cau-dieu-tra-lam-ro-cac-vu-viec-tre-em-bi-duoi-nuoc-20240530123040464.htm,vi-tre-em
Tai nạn đuối nước ở trẻ vẫn là con số xót xa,0,dansinh_vi_tre_em,https://dansinh.dantri.com.vn/vi-tre-em/tai-nan-duoi-nuoc-o-tre-van-la-con-so-xot-xa-20240530095621618.htm,vi-tre-em
Học sinh Phú Thọ đạt giải nhất IOE: Đều đặn lên Hà Nội giao tiếp tiếng Anh,0,dansinh_vi_tre_em,https://dansinh.dantri.com.vn/vi-tre-em/hoc-sinh-phu-tho-dat-giai-nhat-ioe-deu-dan-len-ha-noi-giao-tiep-tieng-anh-20240529161023179.htm,vi-tre-em
Tỉnh Bắc Giang áp dụng nhiều điểm mới trong kỳ thi vào lớp 10 THPT,0,dansinh_vi_tre_em,https://dansinh.dantri.com.vn/vi-tre-em/tinh-bac-giang-ap-dung-nhieu-diem-moi-trong-ky-thi-vao-lop-10-thpt-20240529111435745.htm,vi-tre-em
"Công an nhận chăm sóc, hỗ trợ 3.084 trẻ em mồ côi, hoàn cảnh khó khăn",0,dansinh_vi_tre_em,https://dansinh.dantri.com.vn/vi-tre-em/cong-an-nhan-cham-soc-ho-tro-3084-tre-em-mo-coi-hoan-canh-kho-khan-20240529103447617.htm,vi-tre-em
"Phao cứu khẩn cấp cho trẻ em bị bạo lực, xâm hại",0,dansinh_vi_tre_em,https://dansinh.dantri.com.vn/vi-tre-em/phao-cuu-khan-cap-cho-tre-em-bi-bao-luc-xam-hai-20240527124922094.htm,vi-tre-em
Trẻ em cần có không gian vui chơi an toàn trong mùa hè,0,dansinh_vi_tre_em,https://dansinh.dantri.com.vn/vi-tre-em/tre-em-can-co-khong-gian-vui-choi-an-toan-trong-mua-he-20240527123621911.htm,vi-tre-em
"Học sinh TPHCM giành giải nhất chương trình ""Vươn cao ước mơ""",0,dansinh_vi_tre_em,https://dansinh.dantri.com.vn/vi-tre-em/hoc-sinh-tphcm-gianh-giai-nhat-chuong-trinh-vuon-cao-uoc-mo-20240528213658758.htm,vi-tre-em
"Học sinh tập làm phim, có cơ hội đưa phim lên sóng truyền hình",0,dansinh_vi_tre_em,https://dansinh.dantri.com.vn/vi-tre-em/hoc-sinh-tap-lam-phim-co-co-hoi-dua-phim-len-song-truyen-hinh-20240528142544894.htm,vi-tre-em
Gia tăng bệnh tay chân miệng khu vực phía Nam,0,dansinh_vi_tre_em,https://dansinh.dantri.com.vn/vi-tre-em/gia-tang-benh-tay-chan-mieng-khu-vuc-phia-nam-20240528093858027.htm,vi-tre-em
Tăng cường khả năng thích ứng với biến đổi khí hậu của trẻ em và cộng đồng,0,dansinh_vi_tre_em,https://dansinh.dantri.com.vn/vi-tre-em/tang-cuong-kha-nang-thich-ung-voi-bien-doi-khi-hau-cua-tre-em-va-cong-dong-20240528095051093.htm,vi-tre-em
Cập nhật danh sách các trường đại học xét tuyển học bạ THPT 2024,0,dansinh_vi_tre_em,https://dansinh.dantri.com.vn/vi-tre-em/cap-nhat-danh-sach-cac-truong-dai-hoc-xet-tuyen-hoc-ba-thpt-2024-20240528090037100.htm,vi-tre-em
Cứ 8 trẻ em trên thế giới thì có 1 trẻ bị lạm dụng tình dục trực tuyến,0,dansinh_vi_tre_em,https://dansinh.dantri.com.vn/vi-tre-em/cu-8-tre-em-tren-the-gioi-thi-co-1-tre-bi-lam-dung-tinh-duc-truc-tuyen-20240528102516444.htm,vi-tre-em
3 trường hợp được xét đặc cách tốt nghiệp THPT năm 2024,0,dansinh_vi_tre_em,https://dansinh.dantri.com.vn/vi-tre-em/3-truong-hop-duoc-xet-dac-cach-tot-nghiep-thpt-nam-2024-20240527102119038.htm,vi-tre-em
Nhiều trẻ nhập viện do tai nạn thương tích mặc dù chưa nghỉ hè,0,dansinh_vi_tre_em,https://dansinh.dantri.com.vn/vi-tre-em/nhieu-tre-nhap-vien-do-tai-nan-thuong-tich-mac-du-chua-nghi-he-20240527084729248.htm,vi-tre-em
"Kiểm soát thái quá khiến trẻ ""ngộp thở""",0,dansinh_vi_tre_em,https://dansinh.dantri.com.vn/vi-tre-em/kiem-soat-thai-qua-khien-tre-ngop-tho-20240521220810651.htm,vi-tre-em
Càng học giỏi càng áp lực,0,dansinh_vi_tre_em,https://dansinh.dantri.com.vn/vi-tre-em/cang-hoc-gioi-cang-ap-luc-20240521221539730.htm,vi-tre-em
Nhận biết sớm xu hướng nghề nghiệp của con,0,dansinh_vi_tre_em,https://dansinh.dantri.com.vn/vi-tre-em/nhan-biet-som-xu-huong-nghe-nghiep-cua-con-20240521215049246.htm,vi-tre-em
"Tầm soát, tư vấn bệnh tim miễn phí cho gần 1.000 trẻ em ở Đắk Lắk",0,dansinh_vi_tre_em,https://dansinh.dantri.com.vn/vi-tre-em/tam-soat-tu-van-benh-tim-mien-phi-cho-gan-1000-tre-em-o-dak-lak-20240526180013463.htm,vi-tre-em
Không chủ quan với viêm phổi ở trẻ em,0,dansinh_vi_tre_em,https://dansinh.dantri.com.vn/vi-tre-em/khong-chu-quan-voi-viem-phoi-o-tre-em-20240521214747794.htm,vi-tre-em
Dạy trẻ chấp nhận sự khác biệt,0,dansinh_vi_tre_em,https://dansinh.dantri.com.vn/vi-tre-em/day-tre-chap-nhan-su-khac-biet-20240521220159864.htm,vi-tre-em
Khám sàng lọc tim và mắt miễn phí cho trẻ em tỉnh Hà Nam,0,dansinh_vi_tre_em,https://dansinh.dantri.com.vn/vi-tre-em/kham-sang-loc-tim-va-mat-mien-phi-cho-tre-em-tinh-ha-nam-20240525152103696.htm,vi-tre-em
Hà Nội ghi nhận 690 ca mắc sốt xuất huyết,0,dansinh_vi_tre_em,https://dansinh.dantri.com.vn/vi-tre-em/ha-noi-ghi-nhan-690-ca-mac-sot-xuat-huyet-20240525111848113.htm,vi-tre-em
Sân khấu thiếu nhi: Khan hiếm kịch bản hay,0,dansinh_vi_tre_em,https://dansinh.dantri.com.vn/vi-tre-em/san-khau-thieu-nhi-khan-hiem-kich-ban-hay-20240523100455728.htm,vi-tre-em
Kỹ năng giúp trẻ có chuyến du lịch an toàn,0,dansinh_vi_tre_em,https://dansinh.dantri.com.vn/vi-tre-em/ky-nang-giup-tre-co-chuyen-du-lich-an-toan-20240521152200330.htm,vi-tre-em
Rộn ràng những điệu xòe trong trường học,0,dansinh_vi_tre_em,https://dansinh.dantri.com.vn/vi-tre-em/ron-rang-nhung-dieu-xoe-trong-truong-hoc-20240521151420651.htm,vi-tre-em
Dinh dưỡng hợp lý cho trẻ trong mùa thi,0,dansinh_vi_tre_em,https://dansinh.dantri.com.vn/vi-tre-em/dinh-duong-hop-ly-cho-tre-trong-mua-thi-20240521214509366.htm,vi-tre-em
"Cập nhật lịch thi, môn thi vào lớp 10 năm 2024 của 63 tỉnh/thành",0,dansinh_vi_tre_em,https://dansinh.dantri.com.vn/vi-tre-em/cap-nhat-lich-thi-mon-thi-vao-lop-10-nam-2024-cua-63-tinhthanh-20240523101537831.htm,vi-tre-em
Danh sách 139 thí sinh miễn thi tốt nghiệp THPT và tuyển thẳng đại học 2024,0,dansinh_vi_tre_em,https://dansinh.dantri.com.vn/vi-tre-em/danh-sach-139-thi-sinh-mien-thi-tot-nghiep-thpt-va-tuyen-thang-dai-hoc-2024-20240523095332133.htm,vi-tre-em
Xã hội hóa nguồn lực chăm lo trẻ em đồng bào dân tộc thiểu số và miền núi,0,dansinh_vi_tre_em,https://dansinh.dantri.com.vn/vi-tre-em/xa-hoi-hoa-nguon-luc-cham-lo-tre-em-dong-bao-dan-toc-thieu-so-va-mien-nui-20240521150427603.htm,vi-tre-em
"Làm việc tốt giúp hình thành nhân cách đẹp, sự tử tế trong thiếu nhi",0,dansinh_vi_tre_em,https://dansinh.dantri.com.vn/vi-tre-em/lam-viec-tot-giup-hinh-thanh-nhan-cach-dep-su-tu-te-trong-thieu-nhi-20240521144845297.htm,vi-tre-em
Ngày Vệ sinh Kinh nguyệt Thế giới: Biến điều khó nói thành điều bình thường,0,dansinh_vi_tre_em,https://dansinh.dantri.com.vn/vi-tre-em/ngay-ve-sinh-kinh-nguyet-the-gioi-bien-dieu-kho-noi-thanh-dieu-binh-thuong-20240522174607284.htm,vi-tre-em
Nàng “tiểu tiên cá” dạy bơi cho trẻ em,0,dansinh_vi_tre_em,https://dansinh.dantri.com.vn/vi-tre-em/nang-tieu-tien-ca-day-boi-cho-tre-em-20240521145350114.htm,vi-tre-em
"Hàng triệu trẻ em ở Đông và Nam Phi phải nghỉ học do khủng hoảng, xung đột",0,dansinh_vi_tre_em,https://dansinh.dantri.com.vn/vi-tre-em/hang-trieu-tre-em-o-dong-va-nam-phi-phai-nghi-hoc-do-khung-hoang-xung-dot-20240521150846192.htm,vi-tre-em
"Tình yêu thương Bác Hồ dành cho thiếu niên, nhi đồng sinh động và sâu sắc",0,dansinh_vi_tre_em,https://dansinh.dantri.com.vn/vi-tre-em/tinh-yeu-thuong-bac-ho-danh-cho-thieu-nien-nhi-dong-sinh-dong-va-sau-sac-20240521141432755.htm,vi-tre-em
Chúng em kể chuyện Bác Hồ,0,dansinh_vi_tre_em,https://dansinh.dantri.com.vn/vi-tre-em/chung-em-ke-chuyen-bac-ho-20240521143610597.htm,vi-tre-em
Trẻ nghiện mạng xã hội có nguy cơ rối nhiễu tâm trí,0,dansinh_vi_tre_em,https://dansinh.dantri.com.vn/vi-tre-em/tre-nghien-mang-xa-hoi-co-nguy-co-roi-nhieu-tam-tri-20240521085326357.htm,vi-tre-em
Sợ hãi khi trẻ bị nhiễm giun đũa chó mèo dù chưa bao giờ nuôi thú cưng,0,dansinh_vi_tre_em,https://dansinh.dantri.com.vn/vi-tre-em/so-hai-khi-tre-bi-nhiem-giun-dua-cho-meo-du-chua-bao-gio-nuoi-thu-cung-20240519131441191.htm,vi-tre-em
Trao 10 giải Nhất cuộc thi vẽ tranh về chiến thắng Điện Biên Phủ,0,dansinh_vi_tre_em,https://dansinh.dantri.com.vn/vi-tre-em/trao-10-giai-nhat-cuoc-thi-ve-tranh-ve-chien-thang-dien-bien-phu-20240520234327671.htm,vi-tre-em
Giáo dục giới tính: “Áo giáp”giúp con tự bảo vệ,0,dansinh_vi_tre_em,https://dansinh.dantri.com.vn/vi-tre-em/giao-duc-gioi-tinh-ao-giapgiup-con-tu-bao-ve-20240518163700791.htm,vi-tre-em
Hành trình chinh phục ước mơ Oxford của “chiến thần học bổng” xứ Nghệ,0,dansinh_vi_tre_em,https://dansinh.dantri.com.vn/vi-tre-em/hanh-trinh-chinh-phuc-uoc-mo-oxford-cua-chien-than-hoc-bong-xu-nghe-20240519082024758.htm,vi-tre-em
Nghề giáo không lương - Tiếp lửa tri thức đến làng trẻ SOS Hà Nội,0,dansinh_vi_tre_em,https://dansinh.dantri.com.vn/vi-tre-em/nghe-giao-khong-luong-tiep-lua-tri-thuc-den-lang-tre-sos-ha-noi-20240519204314190.htm,vi-tre-em
"Gaza: Xung đột kéo dài, trẻ em lỡ năm học mới",0,dansinh_vi_tre_em,https://dansinh.dantri.com.vn/vi-tre-em/gaza-xung-dot-keo-dai-tre-em-lo-nam-hoc-moi-20240920133117776.htm,vi-tre-em
Khi trẻ em nghiện thiết bị điện tử,0,dansinh_vi_tre_em,https://dansinh.dantri.com.vn/vi-tre-em/khi-tre-em-nghien-thiet-bi-dien-tu-20240913213135108.htm,vi-tre-em
Các sáng kiến trong ứng dụng công nghệ số vào giáo dục,0,dansinh_vi_tre_em,https://dansinh.dantri.com.vn/vi-tre-em/cac-sang-kien-trong-ung-dung-cong-nghe-so-vao-giao-duc-20240913213458223.htm,vi-tre-em
Cận cảnh vẻ hiện đại bậc nhất Việt Nam của Cung Thiếu nhi hơn 1.300 tỷ đồng,0,dansinh_vi_tre_em,https://dansinh.dantri.com.vn/vi-tre-em/can-canh-ve-hien-dai-bac-nhat-viet-nam-cua-cung-thieu-nhi-hon-1300-ty-dong-20240920170916171.htm,vi-tre-em
Thi viết “Những kỷ niệm sâu sắc về thầy cô và mái trường”,0,dansinh_vi_tre_em,https://dansinh.dantri.com.vn/vi-tre-em/thi-viet-nhung-ky-niem-sau-sac-ve-thay-co-va-mai-truong-20240920114600575.htm,vi-tre-em
Tận dụng trí tuệ nhân tạo trong học tập,0,dansinh_vi_tre_em,https://dansinh.dantri.com.vn/vi-tre-em/tan-dung-tri-tue-nhan-tao-trong-hoc-tap-20240913214243666.htm,vi-tre-em
"Quy định về niên hạn đối với xe ô tô chở trẻ em mầm non, học sinh",0,dansinh_vi_tre_em,https://dansinh.dantri.com.vn/vi-tre-em/quy-dinh-ve-nien-han-doi-voi-xe-o-to-cho-tre-em-mam-non-hoc-sinh-20240920070439601.htm,vi-tre-em
"Lắng nghe trẻ em để ""mầm xanh"" lớn lên trong môi trường đầy đủ yêu thương",0,dansinh_vi_tre_em,https://dansinh.dantri.com.vn/vi-tre-em/lang-nghe-tre-em-de-mam-xanh-lon-len-trong-moi-truong-day-du-yeu-thuong-20240919205732378.htm,vi-tre-em
Ứng phó bão số 4: Cân nhắc cho học sinh nghỉ học tại 17 địa phương,0,dansinh_vi_tre_em,https://dansinh.dantri.com.vn/vi-tre-em/ung-pho-bao-so-4-can-nhac-cho-hoc-sinh-nghi-hoc-tai-17-dia-phuong-20240919131701893.htm,vi-tre-em
Một trường học đang xây dựng ở Thanh Hóa có nguy cơ đổ sập vì sạt lở,0,dansinh_vi_tre_em,https://dansinh.dantri.com.vn/vi-tre-em/mot-truong-hoc-dang-xay-dung-o-thanh-hoa-co-nguy-co-do-sap-vi-sat-lo-20240919122348471.htm,vi-tre-em
Nỗ lực góp phần đa dạng nguồn dinh dưỡng cần thiết cho trẻ em nghèo,0,dansinh_vi_tre_em,https://dansinh.dantri.com.vn/vi-tre-em/no-luc-gop-phan-da-dang-nguon-dinh-duong-can-thiet-cho-tre-em-ngheo-20240917173739044.htm,vi-tre-em
"Vì bênh con, dùng bạo lực giải quyết mâu thuẫn coi chừng vi phạm pháp luật",0,dansinh_vi_tre_em,https://dansinh.dantri.com.vn/vi-tre-em/vi-benh-con-dung-bao-luc-giai-quyet-mau-thuan-coi-chung-vi-pham-phap-luat-20240914000217374.htm,vi-tre-em
Cách nào giúp trẻ em vượt qua chấn thương tâm lý sau thiên tai?,0,dansinh_vi_tre_em,https://dansinh.dantri.com.vn/vi-tre-em/cach-nao-giup-tre-em-vuot-qua-chan-thuong-tam-ly-sau-thien-tai-20240916232547629.htm,vi-tre-em
"Phòng, chống đuối nước trẻ em mùa mưa bão: Không thể lơ là",0,dansinh_vi_tre_em,https://dansinh.dantri.com.vn/vi-tre-em/phong-chong-duoi-nuoc-tre-em-mua-mua-bao-khong-the-lo-la-20240916234830448.htm,vi-tre-em
"Phòng, chống bạo lực, xâm hại trẻ em khi có thiên tai",0,dansinh_vi_tre_em,https://dansinh.dantri.com.vn/vi-tre-em/phong-chong-bao-luc-xam-hai-tre-em-khi-co-thien-tai-20240916231143040.htm,vi-tre-em
Rực rỡ sắc màu trên phố Hàng Mã - “Thủ phủ” đồ chơi Trung thu,0,dansinh_vi_tre_em,https://dansinh.dantri.com.vn/vi-tre-em/ruc-ro-sac-mau-tren-pho-hang-ma-thu-phu-do-choi-trung-thu-20240916220623564.htm,vi-tre-em
Bí thư huyện Krông Búk thăm hỏi gia đình học sinh tử vong do xe lùi trúng,0,dansinh_vi_tre_em,https://dansinh.dantri.com.vn/vi-tre-em/bi-thu-huyen-krong-buk-tham-hoi-gia-dinh-hoc-sinh-tu-vong-do-xe-lui-trung-20240916202451101.htm,vi-tre-em
"Trung thu ấm tình đến với 300 trẻ em khuyết tật, trẻ có hoàn cảnh đặc biệt",0,dansinh_vi_tre_em,https://dansinh.dantri.com.vn/vi-tre-em/trung-thu-am-tinh-den-voi-300-tre-em-khuyet-tat-tre-co-hoan-canh-dac-biet-20240916193530479.htm,vi-tre-em
"Bắc Giang xây dựng môi trường an toàn, thân thiện cho trẻ em ở xã, phường",0,dansinh_vi_tre_em,https://dansinh.dantri.com.vn/vi-tre-em/bac-giang-xay-dung-moi-truong-an-toan-than-thien-cho-tre-em-o-xa-phuong-20240913212351745.htm,vi-tre-em
"ESG yêu cầu doanh nghiệp có đạo đức, trách nhiệm, tôn trọng quyền trẻ em",0,dansinh_vi_tre_em,https://dansinh.dantri.com.vn/vi-tre-em/esg-yeu-cau-doanh-nghiep-co-dao-duc-trach-nhiem-ton-trong-quyen-tre-em-20240913144450549.htm,vi-tre-em
"Tự làm các loại bánh Trung thu ngon, chuẩn vị và đẹp mắt như ngoài tiệm",0,dansinh_vi_tre_em,https://dansinh.dantri.com.vn/vi-tre-em/tu-lam-cac-loai-banh-trung-thu-ngon-chuan-vi-va-dep-mat-nhu-ngoai-tiem-20240915150026918.htm,vi-tre-em
"Chùm phim hoạt hình đặc biệt về phòng, chống thiên tai trên truyền hình",0,dansinh_vi_tre_em,https://dansinh.dantri.com.vn/vi-tre-em/chum-phim-hoat-hinh-dac-biet-ve-phong-chong-thien-tai-tren-truyen-hinh-20240915134850380.htm,vi-tre-em
“Trung thu cùng bạn vui đến trường” với thiếu nhi Đắk Lắk,0,dansinh_vi_tre_em,https://dansinh.dantri.com.vn/vi-tre-em/trung-thu-cung-ban-vui-den-truong-voi-thieu-nhi-dak-lak-20240915123502977.htm,vi-tre-em
"""Ảo tung chảo"" ngôn ngữ chat, tự chế và trào lưu tiếng lóng mạng xã hội",0,dansinh_vi_tre_em,https://dansinh.dantri.com.vn/vi-tre-em/ao-tung-chao-ngon-ngu-chat-tu-che-va-trao-luu-tieng-long-mang-xa-hoi-20240913213821453.htm,vi-tre-em
