free_text,label_id,source,url,category
"Bồi dưỡng học sinh giỏi tiếng Anh 8, An Nhiên",0,diendantailieu,https://diendantailieu.com/threads/b%E1%BB%93i-d%C6%B0%E1%BB%A1ng-h%E1%BB%8Dc-sinh-gi%E1%BB%8Fi-ti%E1%BA%BFng-anh-8-an-nhi%C3%AAn.20693/,khác
"Giáo trình bồi dưỡng học sinh giỏi và chuyên tiếng Anh cấp THCS, Trần Trường Thành 329 trang",0,diendantailieu,https://diendantailieu.com/threads/gi%C3%A1o-tr%C3%ACnh-b%E1%BB%93i-d%C6%B0%E1%BB%A1ng-h%E1%BB%8Dc-sinh-gi%E1%BB%8Fi-v%C3%A0-chuy%C3%AAn-ti%E1%BA%BFng-anh-c%E1%BA%A5p-thcs-tr%E1%BA%A7n-tr%C6%B0%E1%BB%9Dng-th%C3%A0nh-329-trang.20663/,khác
"Bộ đề luyện thi Trung học phổ thông chuyên môn Tiếng Anh 2022, Giang Thị Trang, Nguyễn Huy Hoàng",0,diendantailieu,https://diendantailieu.com/threads/b%E1%BB%99-%C4%91%E1%BB%81-luy%E1%BB%87n-thi-trung-h%E1%BB%8Dc-ph%E1%BB%95-th%C3%B4ng-chuy%C3%AAn-m%C3%B4n-ti%E1%BA%BFng-anh-2022-giang-th%E1%BB%8B-trang-nguy%E1%BB%85n-huy-ho%C3%A0ng.17952/,khác
"Đề luyện tập môn tiếng Anh, thi đánh giá năng lực vào lớp 10 chuyên ngoại ngữ, 3rd edition, Phạm Thị",0,diendantailieu,https://diendantailieu.com/threads/%C4%90%E1%BB%81-luy%E1%BB%87n-t%E1%BA%ADp-m%C3%B4n-ti%E1%BA%BFng-anh-thi-%C4%91%C3%A1nh-gi%C3%A1-n%C4%83ng-l%E1%BB%B1c-v%C3%A0o-l%E1%BB%9Bp-10-chuy%C3%AAn-ngo%E1%BA%A1i-ng%E1%BB%AF-3rd-edition-ph%E1%BA%A1m-th%E1%BB%8B.24704/,khác
"Đề luyện tập môn toán và khoa học tự nhiên, 3rd edition, thi đánh giá năng lực vào lớp 10 chuyên ngo",0,diendantailieu,https://diendantailieu.com/threads/%C4%90%E1%BB%81-luy%E1%BB%87n-t%E1%BA%ADp-m%C3%B4n-to%C3%A1n-v%C3%A0-khoa-h%E1%BB%8Dc-t%E1%BB%B1-nhi%C3%AAn-3rd-edition-thi-%C4%91%C3%A1nh-gi%C3%A1-n%C4%83ng-l%E1%BB%B1c-v%C3%A0o-l%E1%BB%9Bp-10-chuy%C3%AAn-ngo.24273/,khác
"Đề luyện tập môn ngữ văn và khoa học xã hội, 3rd edition, thi đánh giá năng lực vào lớp 10 chuyên ng",0,diendantailieu,https://diendantailieu.com/threads/%C4%90%E1%BB%81-luy%E1%BB%87n-t%E1%BA%ADp-m%C3%B4n-ng%E1%BB%AF-v%C4%83n-v%C3%A0-khoa-h%E1%BB%8Dc-x%C3%A3-h%E1%BB%99i-3rd-edition-thi-%C4%91%C3%A1nh-gi%C3%A1-n%C4%83ng-l%E1%BB%B1c-v%C3%A0o-l%E1%BB%9Bp-10-chuy%C3%AAn-ng.24272/,khác
"Tài liệu ôn tập thi chuyên ngoại ngữ môn tiếng Anh, Phạm Thị Mai Hương",0,diendantailieu,https://diendantailieu.com/threads/t%C3%A0i-li%E1%BB%87u-%C3%B4n-t%E1%BA%ADp-thi-chuy%C3%AAn-ngo%E1%BA%A1i-ng%E1%BB%AF-m%C3%B4n-ti%E1%BA%BFng-anh-ph%E1%BA%A1m-th%E1%BB%8B-mai-h%C6%B0%C6%A1ng.17954/,khác
"Luyện tập thi vào lớp 10 Chuyên Ngoại Ngữ, Môn Toán, PGS. TS. Nguyễn Thành Văn, Nguyễn Cảnh Duy",0,diendantailieu,https://diendantailieu.com/threads/luy%E1%BB%87n-t%E1%BA%ADp-thi-v%C3%A0o-l%E1%BB%9Bp-10-chuy%C3%AAn-ngo%E1%BA%A1i-ng%E1%BB%AF-m%C3%B4n-to%C3%A1n-pgs-ts-nguy%E1%BB%85n-th%C3%A0nh-v%C4%83n-nguy%E1%BB%85n-c%E1%BA%A3nh-duy.16758/,khác
"Tài liệu hướng dẫn ôn thi vào lớp 10 môn toán, phiên bản mới nhất, Phạm Văn Thạo",0,diendantailieu,https://diendantailieu.com/threads/t%C3%A0i-li%E1%BB%87u-h%C6%B0%E1%BB%9Bng-d%E1%BA%ABn-%C3%B4n-thi-v%C3%A0o-l%E1%BB%9Bp-10-m%C3%B4n-to%C3%A1n-phi%C3%AAn-b%E1%BA%A3n-m%E1%BB%9Bi-nh%E1%BA%A5t-ph%E1%BA%A1m-v%C4%83n-th%E1%BA%A1o.15036/,khác
"Bộ đề thi tuyển sinh các năm vào lớp 10 chuyên môn tiếng Anh, Trường ĐH Ngoại Ngữ, Trường PT Chuyên",0,diendantailieu,https://diendantailieu.com/threads/b%E1%BB%99-%C4%91%E1%BB%81-thi-tuy%E1%BB%83n-sinh-c%C3%A1c-n%C4%83m-v%C3%A0o-l%E1%BB%9Bp-10-chuy%C3%AAn-m%C3%B4n-ti%E1%BA%BFng-anh-tr%C6%B0%E1%BB%9Dng-%C4%90h-ngo%E1%BA%A1i-ng%E1%BB%AF-tr%C6%B0%E1%BB%9Dng-pt-chuy%C3%AAn.14000/,khác
"Luyện tập thi vào lớp 10 chuyên ngoại ngữ - Môn Ngữ Văn, Hồ Thị Giang",0,diendantailieu,https://diendantailieu.com/threads/luy%E1%BB%87n-t%E1%BA%ADp-thi-v%C3%A0o-l%E1%BB%9Bp-10-chuy%C3%AAn-ngo%E1%BA%A1i-ng%E1%BB%AF-m%C3%B4n-ng%E1%BB%AF-v%C4%83n-h%E1%BB%93-th%E1%BB%8B-giang.13990/,khác
"Hướng dẫn ôn thi trắc nghiệm môn toán vào lớp 10 THPT Chuyên ngữ Hà Nội, Phạm Văn Thạo",0,diendantailieu,https://diendantailieu.com/threads/h%C6%B0%E1%BB%9Bng-d%E1%BA%ABn-%C3%B4n-thi-tr%E1%BA%AFc-nghi%E1%BB%87m-m%C3%B4n-to%C3%A1n-v%C3%A0o-l%E1%BB%9Bp-10-thpt-chuy%C3%AAn-ng%E1%BB%AF-h%C3%A0-n%E1%BB%99i-ph%E1%BA%A1m-v%C4%83n-th%E1%BA%A1o.13172/,khác
"Tài liệu hướng dẫn ôn thi vào lớp 10 trường THPT chuyên ngữ, môn toán, Phạm Văn Thạo",0,diendantailieu,https://diendantailieu.com/threads/t%C3%A0i-li%E1%BB%87u-h%C6%B0%E1%BB%9Bng-d%E1%BA%ABn-%C3%B4n-thi-v%C3%A0o-l%E1%BB%9Bp-10-tr%C6%B0%E1%BB%9Dng-thpt-chuy%C3%AAn-ng%E1%BB%AF-m%C3%B4n-to%C3%A1n-ph%E1%BA%A1m-v%C4%83n-th%E1%BA%A1o.13171/,khác
"Đề thi và hướng dẫn giải môn toán vào lớp 10 thpt chuyên ngữ Hà Nội, môn toán, Phạm Văn Thạo",0,diendantailieu,https://diendantailieu.com/threads/%C4%90%E1%BB%81-thi-v%C3%A0-h%C6%B0%E1%BB%9Bng-d%E1%BA%ABn-gi%E1%BA%A3i-m%C3%B4n-to%C3%A1n-v%C3%A0o-l%E1%BB%9Bp-10-thpt-chuy%C3%AAn-ng%E1%BB%AF-h%C3%A0-n%E1%BB%99i-m%C3%B4n-to%C3%A1n-ph%E1%BA%A1m-v%C4%83n-th%E1%BA%A1o.13170/,khác
"Đề thi và hướng dẫn giải vào lớp 10 thpt chuyên ngữ Hà Nội, môn ngữ văn, Nguyễn Quang Trung",0,diendantailieu,https://diendantailieu.com/threads/%C4%90%E1%BB%81-thi-v%C3%A0-h%C6%B0%E1%BB%9Bng-d%E1%BA%ABn-gi%E1%BA%A3i-v%C3%A0o-l%E1%BB%9Bp-10-thpt-chuy%C3%AAn-ng%E1%BB%AF-h%C3%A0-n%E1%BB%99i-m%C3%B4n-ng%E1%BB%AF-v%C4%83n-nguy%E1%BB%85n-quang-trung.13169/,khác
"Tài liệu hướng dẫn ôn thi vào lớp 10 trường THPT chuyên ngữ Hà Nội, môn Ngữ Văn, Nguyễn Quang Trung",0,diendantailieu,https://diendantailieu.com/threads/t%C3%A0i-li%E1%BB%87u-h%C6%B0%E1%BB%9Bng-d%E1%BA%ABn-%C3%B4n-thi-v%C3%A0o-l%E1%BB%9Bp-10-tr%C6%B0%E1%BB%9Dng-thpt-chuy%C3%AAn-ng%E1%BB%AF-h%C3%A0-n%E1%BB%99i-m%C3%B4n-ng%E1%BB%AF-v%C4%83n-nguy%E1%BB%85n-quang-trung.13168/,khác
"Tài liệu hướng dẫn ôn thi vào lớp 10 trường THPT chuyên ngữ Hà Nội, ĐHQG, môn Tiếng Anh",0,diendantailieu,https://diendantailieu.com/threads/t%C3%A0i-li%E1%BB%87u-h%C6%B0%E1%BB%9Bng-d%E1%BA%ABn-%C3%B4n-thi-v%C3%A0o-l%E1%BB%9Bp-10-tr%C6%B0%E1%BB%9Dng-thpt-chuy%C3%AAn-ng%E1%BB%AF-h%C3%A0-n%E1%BB%99i-%C4%90hqg-m%C3%B4n-ti%E1%BA%BFng-anh.13167/,khác
"Đề thi và hướng dẫn giải môn tếng vào lớp 10 trường chuyên ngữ Hà Nội, môn Tiếng anh",0,diendantailieu,https://diendantailieu.com/threads/%C4%90%E1%BB%81-thi-v%C3%A0-h%C6%B0%E1%BB%9Bng-d%E1%BA%ABn-gi%E1%BA%A3i-m%C3%B4n-t%E1%BA%BFng-v%C3%A0o-l%E1%BB%9Bp-10-tr%C6%B0%E1%BB%9Dng-chuy%C3%AAn-ng%E1%BB%AF-h%C3%A0-n%E1%BB%99i-m%C3%B4n-ti%E1%BA%BFng-anh.13166/,khác
"Drill for Skill, An Amsco School Publication",0,diendantailieu,https://diendantailieu.com/threads/drill-for-skill-an-amsco-school-publication.31486/,khác
"Dicionario da Lingua Portuguesa, Porto Editora",0,diendantailieu,https://diendantailieu.com/threads/dicionario-da-lingua-portuguesa-porto-editora.31447/,khác
"Ngữ pháp tiếng Anh cơ bản và nâng cao tập 2, Bùi Văn Vinh",0,diendantailieu,https://diendantailieu.com/threads/ng%E1%BB%AF-ph%C3%A1p-ti%E1%BA%BFng-anh-c%C6%A1-b%E1%BA%A3n-v%C3%A0-n%C3%A2ng-cao-t%E1%BA%ADp-2-b%C3%B9i-v%C4%83n-vinh.30498/,khác
"Ngữ pháp tiếng Anh cơ bản và nâng cao tập 1, Bùi Văn Vinh",0,diendantailieu,https://diendantailieu.com/threads/ng%E1%BB%AF-ph%C3%A1p-ti%E1%BA%BFng-anh-c%C6%A1-b%E1%BA%A3n-v%C3%A0-n%C3%A2ng-cao-t%E1%BA%ADp-1-b%C3%B9i-v%C4%83n-vinh.30497/,khác
IMO Olympiad Workbook 7,0,diendantailieu,https://diendantailieu.com/threads/imo-olympiad-workbook-7.30364/,khác
IMO Olympiad Workbook 6,0,diendantailieu,https://diendantailieu.com/threads/imo-olympiad-workbook-6.30363/,khác
"Maths Olympiad Lessons with Terry Chew, Age 7+ book A",0,diendantailieu,https://diendantailieu.com/threads/maths-olympiad-lessons-with-terry-chew-age-7-book-a.30362/,khác
Toán học chân phương: tài liệu dành cho ai cần Toán - Vinh Phu Nguyen,0,diendantailieu,https://diendantailieu.com/threads/to%C3%A1n-h%E1%BB%8Dc-ch%C3%A2n-ph%C6%B0%C6%A1ng-t%C3%A0i-li%E1%BB%87u-d%C3%A0nh-cho-ai-c%E1%BA%A7n-to%C3%A1n-vinh-phu-nguyen.30215/,khác
"Viết đúng chính tả tiếng Việt khó mà dễ, Nguyễn Trí, Phạm Đình Ân, Cao Tuyết Minh",0,diendantailieu,https://diendantailieu.com/threads/vi%E1%BA%BFt-%C4%91%C3%BAng-ch%C3%ADnh-t%E1%BA%A3-ti%E1%BA%BFng-vi%E1%BB%87t-kh%C3%B3-m%C3%A0-d%E1%BB%85-nguy%E1%BB%85n-tr%C3%AD-ph%E1%BA%A1m-%C4%90%C3%ACnh-%C3%82n-cao-tuy%E1%BA%BFt-minh.30121/,khác
"303 kid-approved exercises and active games, Kimberly Wechsler",0,diendantailieu,https://diendantailieu.com/threads/303-kid-approved-exercises-and-active-games-kimberly-wechsler.29837/,khác
"Giáo dục thành công theo kiểu Harvard, tập 2 muốn thành công hãy làm người tử tế, Vương Nghệ Lộ",0,diendantailieu,https://diendantailieu.com/threads/gi%C3%A1o-d%E1%BB%A5c-th%C3%A0nh-c%C3%B4ng-theo-ki%E1%BB%83u-harvard-t%E1%BA%ADp-2-mu%E1%BB%91n-th%C3%A0nh-c%C3%B4ng-h%C3%A3y-l%C3%A0m-ng%C6%B0%E1%BB%9Di-t%E1%BB%AD-t%E1%BA%BF-v%C6%B0%C6%A1ng-ngh%E1%BB%87-l%E1%BB%99.29624/,khác
"Từ điển Hán Việt dùng cho học sinh, hội nghiên cứu giảng dạy văn học tp HCM",0,diendantailieu,https://diendantailieu.com/threads/t%E1%BB%AB-%C4%91i%E1%BB%83n-h%C3%A1n-vi%E1%BB%87t-d%C3%B9ng-cho-h%E1%BB%8Dc-sinh-h%E1%BB%99i-nghi%C3%AAn-c%E1%BB%A9u-gi%E1%BA%A3ng-d%E1%BA%A1y-v%C4%83n-h%E1%BB%8Dc-tp-hcm.29354/,khác
Tài liệu tập huấn giảng dạy môn Toán bằng tiếng Anh,0,diendantailieu,https://diendantailieu.com/threads/t%C3%A0i-li%E1%BB%87u-t%E1%BA%ADp-hu%E1%BA%A5n-gi%E1%BA%A3ng-d%E1%BA%A1y-m%C3%B4n-to%C3%A1n-b%E1%BA%B1ng-ti%E1%BA%BFng-anh.29209/,khác
"Từ điển thuật ngữ địa lý, nhân văn, Nguyễn Ngọc Tuấn",0,diendantailieu,https://diendantailieu.com/threads/t%E1%BB%AB-%C4%91i%E1%BB%83n-thu%E1%BA%ADt-ng%E1%BB%AF-%C4%91%E1%BB%8Ba-l%C3%BD-nh%C3%A2n-v%C4%83n-nguy%E1%BB%85n-ng%E1%BB%8Dc-tu%E1%BA%A5n.29110/,khác
"Những bài văn của học sinh giỏi quốc gia, Rubik Văn Chương, Tờ Hoa",0,diendantailieu,https://diendantailieu.com/threads/nh%E1%BB%AFng-b%C3%A0i-v%C4%83n-c%E1%BB%A7a-h%E1%BB%8Dc-sinh-gi%E1%BB%8Fi-qu%E1%BB%91c-gia-rubik-v%C4%83n-ch%C6%B0%C6%A1ng-t%E1%BB%9D-hoa.28762/,khác
"Phương pháp học tuyệt chiêu, Bs. Lê Văn Đạt Nhân",0,diendantailieu,https://diendantailieu.com/threads/ph%C6%B0%C6%A1ng-ph%C3%A1p-h%E1%BB%8Dc-tuy%E1%BB%87t-chi%C3%AAu-bs-l%C3%AA-v%C4%83n-%C4%90%E1%BA%A1t-nh%C3%A2n.28402/,khác
"Improving Student Writing Skills, Garth Sundem, Shell Education",0,diendantailieu,https://diendantailieu.com/threads/improving-student-writing-skills-garth-sundem-shell-education.28283/,khác
"Tiếng Anh giáo dục mầm non, Hoàng Quý Tỉnh, English Preschool Education",0,diendantailieu,https://diendantailieu.com/threads/ti%E1%BA%BFng-anh-gi%C3%A1o-d%E1%BB%A5c-m%E1%BA%A7m-non-ho%C3%A0ng-qu%C3%BD-t%E1%BB%89nh-english-preschool-education.28268/,khác
"Vần quốc ngữ dạy theo phương pháp mới, hội truyền bá học quốc ngữ",0,diendantailieu,https://diendantailieu.com/threads/v%E1%BA%A7n-qu%E1%BB%91c-ng%E1%BB%AF-d%E1%BA%A1y-theo-ph%C6%B0%C6%A1ng-ph%C3%A1p-m%E1%BB%9Bi-h%E1%BB%99i-truy%E1%BB%81n-b%C3%A1-h%E1%BB%8Dc-qu%E1%BB%91c-ng%E1%BB%AF.28127/,khác
"Tranh biện sao cho đúng, Juseung Yi",0,diendantailieu,https://diendantailieu.com/threads/tranh-bi%E1%BB%87n-sao-cho-%C4%91%C3%BAng-juseung-yi.28077/,khác
"Sổ tay từ Hán Việt cho người mới bắt đầu học, Lại Cao Nguyện, Phan Văn Các",0,diendantailieu,https://diendantailieu.com/threads/s%E1%BB%95-tay-t%E1%BB%AB-h%C3%A1n-vi%E1%BB%87t-cho-ng%C6%B0%E1%BB%9Di-m%E1%BB%9Bi-b%E1%BA%AFt-%C4%91%E1%BA%A7u-h%E1%BB%8Dc-l%E1%BA%A1i-cao-nguy%E1%BB%87n-phan-v%C4%83n-c%C3%A1c.10700/,khác
"Bài tập viết lại câu tiếng Anh, the windy",0,diendantailieu,https://diendantailieu.com/threads/b%C3%A0i-t%E1%BA%ADp-vi%E1%BA%BFt-l%E1%BA%A1i-c%C3%A2u-ti%E1%BA%BFng-anh-the-windy.26487/,khác
"Bình giảng ngụ ngôn, Nguyễn Việt Hùng, Phạm Đặng Xuân Hương",0,diendantailieu,https://diendantailieu.com/threads/b%C3%ACnh-gi%E1%BA%A3ng-ng%E1%BB%A5-ng%C3%B4n-nguy%E1%BB%85n-vi%E1%BB%87t-h%C3%B9ng-ph%E1%BA%A1m-%C4%90%E1%BA%B7ng-xu%C3%A2n-h%C6%B0%C6%A1ng.26330/,khác
"Trên bục giảng, Brad Cohen, Lisa Wysocky, Uông Xuân Vy, Vi Thảo Nguyên",0,diendantailieu,https://diendantailieu.com/threads/tr%C3%AAn-b%E1%BB%A5c-gi%E1%BA%A3ng-brad-cohen-lisa-wysocky-u%C3%B4ng-xu%C3%A2n-vy-vi-th%E1%BA%A3o-nguy%C3%AAn.25599/,khác
"Rèn luyện năng lực quản lý thời gian bằng sơ đồ tư duy, Trịnh Quỳnh",0,diendantailieu,https://diendantailieu.com/threads/r%C3%A8n-luy%E1%BB%87n-n%C4%83ng-l%E1%BB%B1c-qu%E1%BA%A3n-l%C3%BD-th%E1%BB%9Di-gian-b%E1%BA%B1ng-s%C6%A1-%C4%91%E1%BB%93-t%C6%B0-duy-tr%E1%BB%8Bnh-qu%E1%BB%B3nh.25238/,khác
"Tự luyện làm câu theo mẫu câu tiếng Anh, Nguyễn Thuần Hậu, Nguyễn Thuần Ngọc Hân",0,diendantailieu,https://diendantailieu.com/threads/t%E1%BB%B1-luy%E1%BB%87n-l%C3%A0m-c%C3%A2u-theo-m%E1%BA%ABu-c%C3%A2u-ti%E1%BA%BFng-anh-nguy%E1%BB%85n-thu%E1%BA%A7n-h%E1%BA%ADu-nguy%E1%BB%85n-thu%E1%BA%A7n-ng%E1%BB%8Dc-h%C3%A2n.25185/,khác
"Reading for you, bí quyết chính phục kỹ năng đọc hiểu tiếng Anh, Dương Hương, Hoàng Đào",0,diendantailieu,https://diendantailieu.com/threads/reading-for-you-b%C3%AD-quy%E1%BA%BFt-ch%C3%ADnh-ph%E1%BB%A5c-k%E1%BB%B9-n%C4%83ng-%C4%91%E1%BB%8Dc-hi%E1%BB%83u-ti%E1%BA%BFng-anh-d%C6%B0%C6%A1ng-h%C6%B0%C6%A1ng-ho%C3%A0ng-%C4%90%C3%A0o.25127/,khác
"Basic English Grammar in Use, the windy, Nguyen Thu Huyen, Ngữ pháp tiếng Anh căn bản",0,diendantailieu,https://diendantailieu.com/threads/basic-english-grammar-in-use-the-windy-nguyen-thu-huyen-ng%E1%BB%AF-ph%C3%A1p-ti%E1%BA%BFng-anh-c%C4%83n-b%E1%BA%A3n.25091/,khác
"Viết luận không khó, Chinh phục viết luận học thuật tiếng Anh, Nguyễn Thúy Lan, Nguyễn Thị Diệu Hà,",0,diendantailieu,https://diendantailieu.com/threads/vi%E1%BA%BFt-lu%E1%BA%ADn-kh%C3%B4ng-kh%C3%B3-chinh-ph%E1%BB%A5c-vi%E1%BA%BFt-lu%E1%BA%ADn-h%E1%BB%8Dc-thu%E1%BA%ADt-ti%E1%BA%BFng-anh-nguy%E1%BB%85n-th%C3%BAy-lan-nguy%E1%BB%85n-th%E1%BB%8B-di%E1%BB%87u-h%C3%A0.25088/,khác
"Phân tích tác phẩm văn học hiện đại Việt Nam từ góc nhìn thể loại, Nguyễn Văn Long",0,diendantailieu,https://diendantailieu.com/threads/ph%C3%A2n-t%C3%ADch-t%C3%A1c-ph%E1%BA%A9m-v%C4%83n-h%E1%BB%8Dc-hi%E1%BB%87n-%C4%91%E1%BA%A1i-vi%E1%BB%87t-nam-t%E1%BB%AB-g%C3%B3c-nh%C3%ACn-th%E1%BB%83-lo%E1%BA%A1i-nguy%E1%BB%85n-v%C4%83n-long.24808/,khác
"Văn học Nga trong nhà trường, Hà Thị Hòa",0,diendantailieu,https://diendantailieu.com/threads/v%C4%83n-h%E1%BB%8Dc-nga-trong-nh%C3%A0-tr%C6%B0%E1%BB%9Dng-h%C3%A0-th%E1%BB%8B-h%C3%B2a.24806/,khác
"Chiếc lá cuối cùng, O Hen-Ri, Lê Huy Bắc",0,diendantailieu,https://diendantailieu.com/threads/chi%E1%BA%BFc-l%C3%A1-cu%E1%BB%91i-c%C3%B9ng-o-hen-ri-l%C3%AA-huy-b%E1%BA%AFc.24672/,khác
"Phương pháp dạy học tác phẩm văn chương theo loại thể, Nguyễn Viết Chữ",0,diendantailieu,https://diendantailieu.com/threads/ph%C6%B0%C6%A1ng-ph%C3%A1p-d%E1%BA%A1y-h%E1%BB%8Dc-t%C3%A1c-ph%E1%BA%A9m-v%C4%83n-ch%C6%B0%C6%A1ng-theo-lo%E1%BA%A1i-th%E1%BB%83-nguy%E1%BB%85n-vi%E1%BA%BFt-ch%E1%BB%AF.24662/,khác
"Kinh nghiệm đọc sách và tự học hiệu quả, tuyển chọn 69 bài viết hay",0,diendantailieu,https://diendantailieu.com/threads/kinh-nghi%E1%BB%87m-%C4%91%E1%BB%8Dc-s%C3%A1ch-v%C3%A0-t%E1%BB%B1-h%E1%BB%8Dc-hi%E1%BB%87u-qu%E1%BA%A3-tuy%E1%BB%83n-ch%E1%BB%8Dn-69-b%C3%A0i-vi%E1%BA%BFt-hay.24621/,khác
"How to Read a Book The Classic Guide to Intelligent Reading, Charles Van Doren Mortimer J. Adler",0,diendantailieu,https://diendantailieu.com/threads/how-to-read-a-book-the-classic-guide-to-intelligent-reading-charles-van-doren-mortimer-j-adler.24601/,khác
"Phương pháp học nhanh gấp 16 lần, thi đỗ vào các trường đại học danh tiếng như Harvard, Todai, Motoy",0,diendantailieu,https://diendantailieu.com/threads/ph%C6%B0%C6%A1ng-ph%C3%A1p-h%E1%BB%8Dc-nhanh-g%E1%BA%A5p-16-l%E1%BA%A7n-thi-%C4%91%E1%BB%97-v%C3%A0o-c%C3%A1c-tr%C6%B0%E1%BB%9Dng-%C4%91%E1%BA%A1i-h%E1%BB%8Dc-danh-ti%E1%BA%BFng-nh%C6%B0-harvard-todai-motoy.24591/,khác
"Chuyên đề, bài tập sinh học theo 4 mức độ vận dụng có lời giải",0,diendantailieu,https://diendantailieu.com/threads/chuy%C3%AAn-%C4%91%E1%BB%81-b%C3%A0i-t%E1%BA%ADp-sinh-h%E1%BB%8Dc-theo-4-m%E1%BB%A9c-%C4%91%E1%BB%99-v%E1%BA%ADn-d%E1%BB%A5ng-c%C3%B3-l%E1%BB%9Di-gi%E1%BA%A3i.24411/,khác
10 bí mật then chốt giúp con thành công đột phá trong vòng 3 tháng,0,diendantailieu,https://diendantailieu.com/threads/10-b%C3%AD-m%E1%BA%ADt-then-ch%E1%BB%91t-gi%C3%BAp-con-th%C3%A0nh-c%C3%B4ng-%C4%91%E1%BB%99t-ph%C3%A1-trong-v%C3%B2ng-3-th%C3%A1ng.24390/,khác
"Không sợ toán học, Jiri Sedlacek, Nguyễn Mậu Vị",0,diendantailieu,https://diendantailieu.com/threads/kh%C3%B4ng-s%E1%BB%A3-to%C3%A1n-h%E1%BB%8Dc-jiri-sedlacek-nguy%E1%BB%85n-m%E1%BA%ADu-v%E1%BB%8B.24130/,khác
"Rèn kĩ năng làm văn tự sự, Trần Thị Thành",0,diendantailieu,https://diendantailieu.com/threads/r%C3%A8n-k%C4%A9-n%C4%83ng-l%C3%A0m-v%C4%83n-t%E1%BB%B1-s%E1%BB%B1-tr%E1%BA%A7n-th%E1%BB%8B-th%C3%A0nh.22845/,khác
"Rèn kĩ năng làm văn thuyết minh, Trần Thị Thành",0,diendantailieu,https://diendantailieu.com/threads/r%C3%A8n-k%C4%A9-n%C4%83ng-l%C3%A0m-v%C4%83n-thuy%E1%BA%BFt-minh-tr%E1%BA%A7n-th%E1%BB%8B-th%C3%A0nh.22844/,khác
"Rèn kĩ năng làm văn biểu cảm, Trần Thị Thành",0,diendantailieu,https://diendantailieu.com/threads/r%C3%A8n-k%C4%A9-n%C4%83ng-l%C3%A0m-v%C4%83n-bi%E1%BB%83u-c%E1%BA%A3m-tr%E1%BA%A7n-th%E1%BB%8B-th%C3%A0nh.22843/,khác
"Rèn kĩ năng làm văn nghị luận, Trần Thị Thành",0,diendantailieu,https://diendantailieu.com/threads/r%C3%A8n-k%C4%A9-n%C4%83ng-l%C3%A0m-v%C4%83n-ngh%E1%BB%8B-lu%E1%BA%ADn-tr%E1%BA%A7n-th%E1%BB%8B-th%C3%A0nh.22788/,khác
"Những nhà giáo dục nổi tiếng các thời đại, Nguyễn Thanh Thủy",0,diendantailieu,https://diendantailieu.com/threads/nh%E1%BB%AFng-nh%C3%A0-gi%C3%A1o-d%E1%BB%A5c-n%E1%BB%95i-ti%E1%BA%BFng-c%C3%A1c-th%E1%BB%9Di-%C4%91%E1%BA%A1i-nguy%E1%BB%85n-thanh-th%E1%BB%A7y.21986/,khác
"Chiến lược ôn thi thủ khoa, phương pháp nhanh nhất để giúp bạn tiến bộ trong học tập, CLB Thủ khoa V",0,diendantailieu,https://diendantailieu.com/threads/chi%E1%BA%BFn-l%C6%B0%E1%BB%A3c-%C3%B4n-thi-th%E1%BB%A7-khoa-ph%C6%B0%C6%A1ng-ph%C3%A1p-nhanh-nh%E1%BA%A5t-%C4%91%E1%BB%83-gi%C3%BAp-b%E1%BA%A1n-ti%E1%BA%BFn-b%E1%BB%99-trong-h%E1%BB%8Dc-t%E1%BA%ADp-clb-th%E1%BB%A7-khoa-v.21788/,khác
"Những viên kim cương trong sinh học PDF, Huỳnh Quốc Thành, 914 trang",0,diendantailieu,https://diendantailieu.com/threads/nh%E1%BB%AFng-vi%C3%AAn-kim-c%C6%B0%C6%A1ng-trong-sinh-h%E1%BB%8Dc-pdf-hu%E1%BB%B3nh-qu%E1%BB%91c-th%C3%A0nh-914-trang.21758/,khác
"Nhiệm vụ triệu đô, cùng con xây dựng sự nghiệp thành công, Han Kok Kwang, Đinh Anh Phương dịch",0,diendantailieu,https://diendantailieu.com/threads/nhi%E1%BB%87m-v%E1%BB%A5-tri%E1%BB%87u-%C4%91%C3%B4-c%C3%B9ng-con-x%C3%A2y-d%E1%BB%B1ng-s%E1%BB%B1-nghi%E1%BB%87p-th%C3%A0nh-c%C3%B4ng-han-kok-kwang-%C4%90inh-anh-ph%C6%B0%C6%A1ng-d%E1%BB%8Bch.20608/,khác
"Thiên văn vật lí, Astrophysics, Donat G.Wentzel, Nguyễn Quang Riệu, Phạm Viết Trinh, Nguyễn Đình Noã",0,diendantailieu,https://diendantailieu.com/threads/thi%C3%AAn-v%C4%83n-v%E1%BA%ADt-l%C3%AD-astrophysics-donat-g-wentzel-nguy%E1%BB%85n-quang-ri%E1%BB%87u-ph%E1%BA%A1m-vi%E1%BA%BFt-trinh-nguy%E1%BB%85n-%C4%90%C3%ACnh-no%C3%A3.20243/,khác
"Tư duy số học, 50 câu đố luyện tập não bộ giúp bạn hình thành tư duy số học, Charles Phillips",0,diendantailieu,https://diendantailieu.com/threads/t%C6%B0-duy-s%E1%BB%91-h%E1%BB%8Dc-50-c%C3%A2u-%C4%91%E1%BB%91-luy%E1%BB%87n-t%E1%BA%ADp-n%C3%A3o-b%E1%BB%99-gi%C3%BAp-b%E1%BA%A1n-h%C3%ACnh-th%C3%A0nh-t%C6%B0-duy-s%E1%BB%91-h%E1%BB%8Dc-charles-phillips.19974/,khác
"Cách chinh phục toán và khoa học, ngay cả khi bạn vừa trượt môn đại số, A mind for numbers, Barbara",0,diendantailieu,https://diendantailieu.com/threads/c%C3%A1ch-chinh-ph%E1%BB%A5c-to%C3%A1n-v%C3%A0-khoa-h%E1%BB%8Dc-ngay-c%E1%BA%A3-khi-b%E1%BA%A1n-v%E1%BB%ABa-tr%C6%B0%E1%BB%A3t-m%C3%B4n-%C4%91%E1%BA%A1i-s%E1%BB%91-a-mind-for-numbers-barbara.19733/,khác
"Bí quyết giúp con giỏi tiếng Anh, cẩm nang hoàn hảo dành cho cha mẹ, Claire Selby",0,diendantailieu,https://diendantailieu.com/threads/b%C3%AD-quy%E1%BA%BFt-gi%C3%BAp-con-gi%E1%BB%8Fi-ti%E1%BA%BFng-anh-c%E1%BA%A9m-nang-ho%C3%A0n-h%E1%BA%A3o-d%C3%A0nh-cho-cha-m%E1%BA%B9-claire-selby.19435/,khác
"Tôi học giỏi, cẩm nang dành cho những người muốn học giỏi để thành đạt, TS. Phó Thu Phương",0,diendantailieu,https://diendantailieu.com/threads/t%C3%B4i-h%E1%BB%8Dc-gi%E1%BB%8Fi-c%E1%BA%A9m-nang-d%C3%A0nh-cho-nh%E1%BB%AFng-ng%C6%B0%E1%BB%9Di-mu%E1%BB%91n-h%E1%BB%8Dc-gi%E1%BB%8Fi-%C4%91%E1%BB%83-th%C3%A0nh-%C4%91%E1%BA%A1t-ts-ph%C3%B3-thu-ph%C6%B0%C6%A1ng.18881/,khác
So sánh chương trình học của Vinschool hệ Cambridge và hệ Chuẩn,0,diendantailieu,https://diendantailieu.com/threads/so-s%C3%A1nh-ch%C6%B0%C6%A1ng-tr%C3%ACnh-h%E1%BB%8Dc-c%E1%BB%A7a-vinschool-h%E1%BB%87-cambridge-v%C3%A0-h%E1%BB%87-chu%E1%BA%A9n.17914/,khác
"Phát triển chương trình đại học theo cách tiếp cận năng lực, xu thế và nhu cầu, TS. Hoàng Thị Tuyết",0,diendantailieu,https://diendantailieu.com/threads/ph%C3%A1t-tri%E1%BB%83n-ch%C6%B0%C6%A1ng-tr%C3%ACnh-%C4%91%E1%BA%A1i-h%E1%BB%8Dc-theo-c%C3%A1ch-ti%E1%BA%BFp-c%E1%BA%ADn-n%C4%83ng-l%E1%BB%B1c-xu-th%E1%BA%BF-v%C3%A0-nhu-c%E1%BA%A7u-ts-ho%C3%A0ng-th%E1%BB%8B-tuy%E1%BA%BFt.17861/,khác
(Bản word) Spotlight on the USA by Randee Falk,0,diendantailieu,https://diendantailieu.com/threads/b%E1%BA%A3n-word-spotlight-on-the-usa-by-randee-falk.17627/,khác
Bộ Video Clip kiến thức giảng dạy cho giáo viên,0,diendantailieu,https://diendantailieu.com/threads/b%E1%BB%99-video-clip-kie%CC%82%CC%81n-thu%CC%9B%CC%81c-gia%CC%89ng-da%CC%A3y-cho-gi%C3%A1o-vi%C3%AAn.17602/,khác
"17 phương trình thay đổi thế giới, 17 equations that changed the world, Ian Stwart",0,diendantailieu,https://diendantailieu.com/threads/17-ph%C6%B0%C6%A1ng-tr%C3%ACnh-thay-%C4%91%E1%BB%95i-th%E1%BA%BF-gi%E1%BB%9Bi-17-equations-that-changed-the-world-ian-stwart.17226/,khác
"Smart thinking Skills for critical Understanding and writing, Oxford, Matthew Allen",0,diendantailieu,https://diendantailieu.com/threads/smart-thinking-skills-for-critical-understanding-and-writing-oxford-matthew-allen.16670/,khác
"How to Write Essays A step-by-step guide for all levels, with sample essays by Don Shiach",0,diendantailieu,https://diendantailieu.com/threads/how-to-write-essays-a-step-by-step-guide-for-all-levels-with-sample-essays-by-don-shiach.16607/,khác
"DK Help Your kids with Growing Up, Robert Winston",0,diendantailieu,https://diendantailieu.com/threads/dk-help-your-kids-with-growing-up-robert-winston.16603/,khác
"Chữa lỗi chính tả cho học sinh, Phan Ngọc",0,diendantailieu,https://diendantailieu.com/threads/ch%E1%BB%AFa-l%E1%BB%97i-ch%C3%ADnh-t%E1%BA%A3-cho-h%E1%BB%8Dc-sinh-phan-ng%E1%BB%8Dc.16155/,khác
"Learning Skills for Success, Lance G. King, Kỹ năng học tập để thành công tập 2",0,diendantailieu,https://diendantailieu.com/threads/learning-skills-for-success-lance-g-king-k%E1%BB%B9-n%C4%83ng-h%E1%BB%8Dc-t%E1%BA%ADp-%C4%91%E1%BB%83-th%C3%A0nh-c%C3%B4ng-t%E1%BA%ADp-2.15951/,khác
"Learning Skills for Success, Lance G. King, Kỹ năng học tập để thành công tập 1",0,diendantailieu,https://diendantailieu.com/threads/learning-skills-for-success-lance-g-king-k%E1%BB%B9-n%C4%83ng-h%E1%BB%8Dc-t%E1%BA%ADp-%C4%91%E1%BB%83-th%C3%A0nh-c%C3%B4ng-t%E1%BA%ADp-1.15949/,khác
"Sổ tay từ Hán Việt, Lại Cao Nguyên, Phan Văn Các",0,diendantailieu,https://diendantailieu.com/threads/s%E1%BB%95-tay-t%E1%BB%AB-h%C3%A1n-vi%E1%BB%87t-l%E1%BA%A1i-cao-nguy%C3%AAn-phan-v%C4%83n-c%C3%A1c.14573/,khác
Giáo trình tự học Piano cơ bản,0,diendantailieu,https://diendantailieu.com/threads/gi%C3%A1o-tr%C3%ACnh-t%E1%BB%B1-h%E1%BB%8Dc-piano-c%C6%A1-b%E1%BA%A3n.14469/,khác
"Địa chí Thừa Thiên Huế, Phần Tự Nhiên",0,diendantailieu,https://diendantailieu.com/threads/%C4%90%E1%BB%8Ba-ch%C3%AD-th%E1%BB%ABa-thi%C3%AAn-hu%E1%BA%BF-ph%E1%BA%A7n-t%E1%BB%B1-nhi%C3%AAn.14335/,khác
"Sổ tay các biện pháp tu từ ngữ nghĩa Tiếng Việt dùng trong nhà trường, Nguyễn Khánh Hà",0,diendantailieu,https://diendantailieu.com/threads/s%E1%BB%95-tay-c%C3%A1c-bi%E1%BB%87n-ph%C3%A1p-tu-t%E1%BB%AB-ng%E1%BB%AF-ngh%C4%A9a-ti%E1%BA%BFng-vi%E1%BB%87t-d%C3%B9ng-trong-nh%C3%A0-tr%C6%B0%E1%BB%9Dng-nguy%E1%BB%85n-kh%C3%A1nh-h%C3%A0.14230/,khác
"Vẻ Đẹp Toán Học – Những Bài Toán Gợi Mở Tư Duy, ALfred S. Posamentier",0,diendantailieu,https://diendantailieu.com/threads/v%E1%BA%BB-%C4%90%E1%BA%B9p-to%C3%A1n-h%E1%BB%8Dc-%E2%80%93-nh%E1%BB%AFng-b%C3%A0i-to%C3%A1n-g%E1%BB%A3i-m%E1%BB%9F-t%C6%B0-duy-alfred-s-posamentier.14182/,khác
"Chương trình giáo dục phổ thông môn tin học, bộ Giáo dục và đào tạo",0,diendantailieu,https://diendantailieu.com/threads/ch%C6%B0%C6%A1ng-tr%C3%ACnh-gi%C3%A1o-d%E1%BB%A5c-ph%E1%BB%95-th%C3%B4ng-m%C3%B4n-tin-h%E1%BB%8Dc-b%E1%BB%99-gi%C3%A1o-d%E1%BB%A5c-v%C3%A0-%C4%91%C3%A0o-t%E1%BA%A1o.13475/,khác
